genre,category,title,year,distribution,description,url,cover_photo
Musical,Hollywood,The Lion King 2019,2019,BluRay,"After the murder of his father, a young lion prince flees his kingdom only to learn the true meaning of responsibility and bravery.",https://fzmovies.net/movie-The%20Lion%20King%202019--hmp4.htm,https://fzmovies.net/imdb_images/The.Lion.King.2019.jpg
Musical,Hollywood,Aladdin,2019,BluRay,A kindhearted street urchin and a power-hungry Grand Vizier vie for a magic lamp that has the power to make their deepest wishes come true.,https://fzmovies.net/movie-Aladdin--hmp4.htm,https://fzmovies.net/imdb_images/Aladdin.2019.jpg
Musical,Hollywood,Frozen 2,2019,BluRay,"Anna, Elsa, Kristoff, Olaf and Sven leave Arendelle to travel to an ancient, autumn-bound forest of an enchanted land. They set out to find the origin of Elsa's powers in order to save their kingdom....<more>",https://fzmovies.net/movie-Frozen%202--hmp4.htm,https://fzmovies.net/imdb_images/Frozen.2.2019.jpg
Musical,Hollywood,Encanto,2021,BluRay,A young Colombian girl has to face the frustration of being the only member of her family without magical powers.Tags : cgi animation...<more>,https://fzmovies.net/movie-Encanto--hmp4.htm,https://fzmovies.net/imdb_images/Encanto.2021.jpg
Musical,Hollywood,The Little Mermaid 2023,2023,BluRay,A young mermaid makes a deal with a sea witch to trade her beautiful voice for human legs so she can discover the world above water and impress a prince....<more>,https://fzmovies.net/movie-The%20Little%20Mermaid%202023--hmp4.htm,https://fzmovies.net/imdb_images/The.Little.Mermaid.2023.jpg
Musical,Hollywood,The Lion King,1994,BluRay,"A lion prince, Simba, is born in Africa and the animals of the Pride Lands pay tribute. Later Simba is told by his father, King Mufasa, that when Mufasa dies, Simba will become King of the Pride Lands. Simba's Uncle Scar would have been king after Musafa had Mufasa not had a child. Fuelled by rage, Scar plots to kill Mufasa and Simba so he is able to take over the throne. He uses the hyenas to cause a stampede through the canyon where Mufasa and Simba are, and personally ensures Mufasa falls to his death. Simba survives so Scar implies that the stampede was Simba's fault and that the pride will blame him. Simba flees the Pride Lands meaning never to return home. Simba is found, collapsed with exhaustion, by Timone the Meerkat, and Pummba the Warthog, and the trio become fast friends. Simba stays with them well into adulthood until his childhood friend, Nala, hunting beyond the Pride Lands that herds had deserted under Scar's mismanagement stumbles upon Simba's new home. Astonished to find him alive, she begs him to return to the Pride Lands, where Scar has reigned as King for years, and ruined everything. All of the animals will starve if Simba does not return. Simba eventually agrees to fight for his kingdom. Simba battles Scar, and learns his father's death was Scar's fault, not his own. Simba prevails and, in time, has his own son, mirroring ""The Circle of Life."" ...<more>",https://fzmovies.net/movie-The%20Lion%20King--hmp4.htm,https://fzmovies.net/imdb_images/The%20Lion%20King.jpg
Musical,Hollywood,Sing 2,2021,BluRay,Buster Moon and his friends must persuade reclusive rock star Clay Calloway to join them for the opening of a new show.Tags : second part...<more>,https://fzmovies.net/movie-Sing%202--hmp4.htm,https://fzmovies.net/imdb_images/Sing.2.2021.jpg
Musical,Hollywood,Trolls World Tour,2020,BluRay,"Poppy and Branch discover that they are but one of six different Troll tribes scattered over six different lands devoted to six different kinds of music: Funk, Country, Techno, Classical, Pop and Rock. Their world is about to get a lot bigger and a whole lot louder. A member of hard-rock royalty,…Tags : sequel | dancing | singing...<more>",https://fzmovies.net/movie-Trolls%20World%20Tour--hmp4.htm,https://fzmovies.net/imdb_images/Trolls.World.Tour.2020.jpg
Musical,Hollywood,Beauty and the Beast 2017,2017,BluRay,An adaptation of the fairy tale about a monstrous-looking prince and a young woman who fall in love.,https://fzmovies.net/movie-Beauty%20and%20the%20Beast%202017--hmp4.htm,https://fzmovies.net/imdb_images/Beauty.And.The.Beast.2017.jpg
Musical,Hollywood,TANGLED,2010,BluRay,"The magically long-haired Rapunzel has spent her entire life in a tower, but now that a runaway thief has stumbled upon her, she is about to discover the world for the first time, and who she really is....<more>",https://fzmovies.net/movie-TANGLED--hmp4.htm,https://fzmovies.net/imdb_images/TANGLED.jpg
Musical,Hollywood,The Greatest Showman,2017,BluRay,"Celebrates the birth of show business, and tells of a visionary who rose from nothing to create a spectacle that became a worldwide sensation.",https://fzmovies.net/movie-The%20Greatest%20Showman--hmp4.htm,https://fzmovies.net/imdb_images/The.Greatest.Showman.2017.jpg
Musical,Hollywood,High School Musical,2006,BluRay,"Troy Bolton and Gabriella Montez are two totally different teenagers who meet at a party while singing karaoke on New Year's Eve. One week later Troy goes back to his high school, East High, in New Mexico to find that Gabriella is a new student there. They quickly become close friends and accidentally audition for the school musical. After getting a callback, drama queen Sharpay Evans and her sidekick brother Ryan are furious. Then Chad, Troy's best friend and basketball teammate, and Taylor, Gabriella's new friend on the decathlon team, must find out a way to make Gabriella hate Troy. ...<more>",https://fzmovies.net/movie-High%20School%20Musical--hmp4.htm,https://fzmovies.net/imdb_images/High%20School%20Musical.jpg
Musical,Hollywood,The Lion King II: Simbas Pride,1998,BluRay,"Simba and Nala have a daughter, Kiara. Timon and Pumbaa are assigned to be her babysitters, but she easily escapes their care and ventures into the forbidden lands. There she meets a lion cub named Kovu and they become friends. What she and her parents do not know is that Kovu is the son of Zira - a banished follower of the now-dead Scar. She plans to raise Kovu to overthrow Simba and become the king of the Pride Lands. This tests not only Kiara and Kovu's relationship as they mature, but Simba's relationship with his daughter. ...<more>",https://fzmovies.net/movie-The%20Lion%20King%20II:%20Simbas%20Pride--hmp4.htm,https://fzmovies.net/imdb_images/The%20Lion%20King%20II:%20Simbas%20Pride.jpg
Musical,Hollywood,Descendants 3,2019,WEBRip,The teenagers of Disney's most infamous villains return to the Isle of the Lost to recruit a new batch of villainous offspring to join them at Auradon Prep. ...<more>,https://fzmovies.net/movie-Descendants%203--hmp4.htm,https://fzmovies.net/imdb_images/Descendants.3.2019.jpg
Musical,Hollywood,High School Musical 2,2007,BluRay,"The Wildcats are back. They start off getting out of school, where Sharpay makes sure Troy has job at her country club. Troy then in returns gets everyone else a job at the country club too. Gabriella is the new lifeguard, while Troy, Chad, and the others work in the kitchen. At the country club there is a talent show, which Sharpay and Ryan win every year. Kelsi had written a song for Troy and Gabriella to sing at the talent show, which later on Sharpay takes (at a faster tempo) for her and Troy to sing at the talent show. Sharpay plots to take Troy away from Gabriella, by getting him a better job than the rest of the Wildcats. Troy starts changing, all for a ""scholarship"", starting to act like a jerk, which results in Gabriella breaking up with Troy, saying she doesn't belong there. After Troy loses all his friends, because he began acting like a jerk and had found out that Sharpay had made it where no Junior Staffers can perform in the talent show, he decides to do something about it, and asks for his old job back with the rest of his friends and quits the talent show leaving Sharpay with nothing, since she had ditched her brother to perform with Troy. She then goes back to Ryan, who had been working with the Junior Staffers on an act, who then leaves her saying she always wanted the spotlight, now she has it. Troy ends up doing the talent show, thinking that he would be performing with Sharpay. He learns a new song within a matter of minutes. ...<more>",https://fzmovies.net/movie-High%20School%20Musical%202--hmp4.htm,https://fzmovies.net/imdb_images/High%20School%20Musical%202.jpg
Musical,Hollywood,Smallfoot,2018,BluRay,"A yeti named Migo is convinced that a human known only as ""Small Foot"" is real and has to prove to his tribe that it does exist with the help of Meechee and the S.E.S - Smallfoot Evidentiary Society. Written by Mark Mason RobledoTags : cgi...<more>",https://fzmovies.net/movie-Smallfoot--hmp4.htm,https://fzmovies.net/imdb_images/Smallfoot.2018.jpg
Musical,Hollywood,High School Musical 3: Senior Year,2008,BluRay,"Troy and the gang of East High School are going through their senior year, facing graduating and going their separate ways. Coming to terms with the reality of it all, Troy wants to attend the nearby University of Albuquerque next year on a basketball scholarship, but Gabriella wants to attend Stanford University in California. Meanwhile, Sharpay, the school's shallow and spoiled rich girl, plots to go all out planning the school's final musical show with the idea to add music to her hopes and fears about the future. While Sharpay takes an up-and-coming British exchange student under her wing, her flamboyant fraternal twin brother, Ryan, has his sights set on something different after school. In addition, Troy's best friend and basketball teammate Chad, and Garbiella's best friend Taylor, all have their sights set on their plans after high school and come to terms with the reality of the real world. ...<more>",https://fzmovies.net/movie-High%20School%20Musical%203:%20Senior%20Year--hmp4.htm,https://fzmovies.net/imdb_images/High%20School%20Musical%203:%20Senior%20Year.jpg
Musical,Hollywood,The Princess and the Frog,2008,BluRay,"A modern day retelling of the classic story The Frog Prince. The Princess and the Frog finds the lives of arrogant, carefree Prince Naveen and hardworking waitress Tiana crossing paths. Prince Naveen is transformed into a frog by a conniving voodoo magician and Tiana, following suit, upon kissing the amphibian royalty. With the help of a trumpet-playing alligator, a Cajun firefly, and an old blind lady who lives in a boat in a tree, Naveen and Tiana must race to break the spell and fulfill their dreams. ...<more>",https://fzmovies.net/movie-The%20Princess%20and%20the%20Frog--hmp4.htm,https://fzmovies.net/imdb_images/The%20Princess%20and%20the%20Frog.jpg
Musical,Hollywood,Cinderella 2021,2021,BluRay,"A modern movie musical with a bold take on the classic fairy tale. Our ambitious heroine has big dreams and with the help of her fab Godmother, she perseveres to make them come true.Tags : fairy | fairy tale | magic...<more>",https://fzmovies.net/movie-Cinderella%202021--hmp4.htm,https://fzmovies.net/imdb_images/Cinderella.2021.jpg
Musical,Hollywood,The Lego Movie 2 The Second Part,2019,BluRay,"It's been five years since everything was awesome and the citizens are facing a huge new threat: Lego Duplo invaders from outer space, wrecking everything faster than they can rebuild. Tags : toy | sequel...<more>",https://fzmovies.net/movie-The%20Lego%20Movie%202%20The%20Second%20Part%20--hmp4.htm,https://fzmovies.net/imdb_images/The.Lego.Movie.2.2019.jpg
Musical,Hollywood,Mary Poppins Returns,2018,BluRay,"In Depression-era London, a now-grown Jane and Michael Banks, along with Michael's three children, are visited by the enigmatic Mary Poppins following a personal loss. Through her unique magical skills, and with the aid of her friend Jack, she helps the family rediscover the joy and wonder missing…Tags : nanny | father | sister...<more>",https://fzmovies.net/movie-Mary%20Poppins%20Returns--hmp4.htm,https://fzmovies.net/imdb_images/Mary.Poppins.Returns.2018.jpg
Musical,Hollywood,La La Land 2016,2016,BluRay,A jazz pianist falls for an aspiring actress in Los Angeles.,https://fzmovies.net/movie-La%20La%20Land%202016--hmp4.htm,https://fzmovies.net/imdb_images/La.La.Land.2016.jpg
Musical,Hollywood,Over the Moon,2020,WEB-DL,"In this animated musical, a girl builds a rocket ship and blasts off, hoping to meet a mythical moon goddess.
Tags : girl...<more>",https://fzmovies.net/movie-Over%20the%20Moon--hmp4.htm,https://fzmovies.net/imdb_images/Over.the.Moon.2020.jpg
Musical,Hollywood,Step Up 2 The Streets 2008,2008,BluRay,Romantic sparks occur between two dance students from different backgrounds at the Maryland School of the Arts.,https://fzmovies.net/movie-Step%20Up%202%20The%20Streets%202008--hmp4.htm,https://fzmovies.net/imdb_images/step.up.2.the.streets.2008.jpg
Musical,Hollywood,The Prince of Egypt,1997,BluRay,"This is the extraordinary tale of two brothers named Moses and Ramses, one born of royal blood, and one an orphan with a secret past. Growing up the best of friends, they share a strong bond of free-spirited youth and good-natured rivalry. But the truth will ultimately set them at odds, as one becomes the ruler of the most powerful empire on earth, and the other the chosen leader of his people! Their final confrontation will forever change their lives and the world. ...<more>",https://fzmovies.net/movie-The%20Prince%20of%20Egypt--hmp4.htm,https://fzmovies.net/imdb_images/The%20Prince%20of%20Egypt.jpg
Musical,Hollywood,Vivo,2021,BluRay,"Vivo, Sony Pictures Animation's first-ever musical adventure featuring all-new original songs from Lin-Manuel Miranda, will take audiences on an epic adventure to gorgeous and vibrant locations never before seen in animation.Tags : epic | cgi animation | singing...<more>",https://fzmovies.net/movie-Vivo--hmp4.htm,https://fzmovies.net/imdb_images/Vivo.2021.jpg
Musical,Hollywood,Romance and Cigarettes,2006,BluRay,"A down-and-dirty musical set in the world of working-class New York, tells a story of a husband's journey into infidelity and redemption when he must choose between his seductive mistress and his beleaguered wife.
A down-and-dirty musical set in the world of working-class New York, tells a story of a husband's journey into infidelity and redemption when he must choose between his seductive mistress and his beleaguered wife.
...<more>",https://fzmovies.net/movie-Romance%20and%20Cigarettes--hmp4.htm,https://fzmovies.net/imdb_images/Romance.and.Cigarettes.2005.jpg
Musical,Hollywood,Camp Rock,2008,BluRay,"""Camp Rock"" centers on a teen girl who desperately wants to spend her summer at a prestigious rock camp, but can only attend if she works in the kitchen as one of the cooks. When she's overheard singing - but not seen -- by a teen pop star at the camp, he is completely taken and sets out to find the girl behind the beautiful voice. But first she must confront her fears, step out of the kitchen and into the spotlight. ...<more>",https://fzmovies.net/movie-Camp%20Rock--hmp4.htm,https://fzmovies.net/imdb_images/Camp%20Rock.jpg
Musical,Hollywood,Mamma Mia Here We Go Again,2018,BluRay,"Discover Donna's (Meryl Streep, Lily James) young life, experiencing the fun she had with the three possible dads of Sophie (Amanda Seyfriend). Sophie is now pregnant. Like Donna, she'll be a young mother, and she realizes that she'll need to take risks like her mother did. Written by Brian Tristam…Tags : sequel | greece...<more>",https://fzmovies.net/movie-Mamma%20Mia%20Here%20We%20Go%20Again--hmp4.htm,https://fzmovies.net/imdb_images/Mamma.Mia.2.2018.jpg
Musical,Hollywood,Yesterday,2019,BluRay,A struggling musician realizes he's the only person on Earth who can remember The Beatles after waking up in an alternate timeline where they never existed. Tags : musician...<more>,https://fzmovies.net/movie-Yesterday--hmp4.htm,https://fzmovies.net/imdb_images/Yesterday.2019.jpg
Musical,Hollywood,Wish 2023,2023,WEBRip,A young girl named Asha wishes on a star and gets a more direct answer than she bargained for when a trouble-making star comes down from the sky to join her.Tags : cgi animation | magic...<more>,https://fzmovies.net/movie-Wish%202023--hmp4.htm,https://fzmovies.net/imdb_images/Wish.2023.jpg
Musical,Hollywood,Camp Rock 2: The Final Jam,2010,BluRay,"Mitchie can't wait to return to camp rock so that she and nice guy rock star Shane can spend the summer making music and having fun with their friends and band mates. But Shane finds himself too busy teaching classes and helping Uncle Brown run the camp to have much fun. Mitchie meets a handsome and talented musician (Luke) from the slick new camp across the lake, and he has all the time in the world for her. All Mitchie's loyalties are tested and she eventually has to choose between Shane and Luke at a dramatic battle of the bands between the rival camps. ...<more>",https://fzmovies.net/movie-Camp%20Rock%202:%20The%20Final%20Jam--hmp4.htm,https://fzmovies.net/imdb_images/Camp%20Rock%202:%20The%20Final%20Jam.jpg
Musical,Hollywood,Cats,2019,BluRay,A tribe of cats called the Jellicles must decide yearly which one will ascend to the Heaviside Layer and come back to a new Jellicle life. Tags : love | friendship | friend...<more>,https://fzmovies.net/movie-Cats--hmp4.htm,https://fzmovies.net/imdb_images/Cats.2019%20.jpg
Musical,Hollywood,The Nightmare Before Christmas,1993,BluRay,"Jack Skellington, the pumpkin king of Halloween Town, is bored with doing the same thing every year for Halloween. One day he stumbles into Christmas Town, and is so taken with the idea of Christmas that he tries to get the resident bats, ghouls, and goblins of Halloween town to help him put on Christmas instead of Halloween -- but alas, they can't get it quite right. ...<more>",https://fzmovies.net/movie-The%20Nightmare%20Before%20Christmas--hmp4.htm,https://fzmovies.net/imdb_images/The%20Nightmare%20Before%20Christmas.jpg
Musical,Hollywood,Corpse Bride,2005,BluRay,"When a shy groom practices his wedding vows in the inadvertent presence of a deceased young woman, she rises from the grave assuming he has married her....<more>",https://fzmovies.net/movie-Corpse%20Bride%20--hmp4.htm,https://fzmovies.net/imdb_images/corpse.bride.2005.jpg
Musical,Hollywood,Peter Pan and Wendy,2023,WEB-DL,"Follow the adventures of a boy who does not want to grow up, and how he recruits three brothers in London, and together they embark on a magical adventure on the enchanted island of Neverland.Tags : fairy | disney | island...<more>",https://fzmovies.net/movie-Peter%20Pan%20and%20Wendy--hmp4.htm,https://fzmovies.net/imdb_images/Peter.Pan.and.Wendy.2023.jpg
Musical,Hollywood,Praise This,2023,WEB-DL,Youth choirs gather together for a music competition.,https://fzmovies.net/movie-Praise%20This--hmp4.htm,https://fzmovies.net/imdb_images/Praise.This.2023.jpg
Musical,Hollywood,Another Cinderella Story,2008,BluRay,"A guy who danced with what could be the girl of his dreams at a costume ball only has one hint at her identity: the Zune she left behind as she rushed home in order to make her curfew. And with a once-in-a-lifetime opportunity in front of him, he sets out to find his masked beauty.
...<more>",https://fzmovies.net/movie-Another%20Cinderella%20Story--hmp4.htm,https://fzmovies.net/imdb_images/Another.Cinderella.Story.2008.jpg
Musical,Hollywood,A Week Away,2021,WEB-DL,"Nowhere left to go, Will Hawkins finds himself at camp for the first time. His instinct is to run, but he finds a friend, a father figure and even a girl who awakens his heart. Most of all, he finally finds a home.
Tags : girl | love...<more>",https://fzmovies.net/movie-A%20Week%20Away--hmp4.htm,https://fzmovies.net/imdb_images/A.Week.Away.2021.jpg
Musical,Hollywood,Slumberland,2022,WEB-DL,"A young girl discovers a secret map to the dreamworld of Slumberland, and with the help of an eccentric outlaw, she traverses dreams and flees nightmares, with the hope that she will be able to see her late father again.Tags : father | monster | secret...<more>",https://fzmovies.net/movie-Slumberland--hmp4.htm,https://fzmovies.net/imdb_images/Slumberland.2022.jpg
Musical,Hollywood,Anastasia,1997,BluRay,"The daughter of last Russian Tsar, Anastasia, is found by two Russian men, Dimitri and Vladimir, who seek the reward that her grandmother, Marie, promised to the ones who'll find her. But the evil mystic of the Tsar family, Rasputin, who for some reason survived in this film, still wants the Romanov family to be destroyed forever. ...<more>",https://fzmovies.net/movie-Anastasia--hmp4.htm,https://fzmovies.net/imdb_images/Anastasia.jpg
Musical,Hollywood,Dreamgirls,2006,BluRay,"A trio of black female soul singers cross over to the pop charts in the early 1960s, facing their own personal struggles along the way.",https://fzmovies.net/movie-Dreamgirls--hmp4.htm,https://fzmovies.net/imdb_images/Dreamgirls.2006.jpg
Musical,Hollywood,Wonka,2023,BluRay,"With dreams of opening a shop in a city renowned for its chocolate, a young and poor Willy Wonka discovers that the industry is run by a cartel of greedy chocolatiers....<more>",https://fzmovies.net/movie-Wonka--hmp4.htm,https://fzmovies.net/imdb_images/Wonka.2023.jpg
Musical,Hollywood,The Ballad of Buster Scruggs,2018,BluRay,"An anthology film comprised of six stories, each dealing with a different aspect of life in the Old West.Tags : parody | cowboy...<more>",https://fzmovies.net/movie-The%20Ballad%20of%20Buster%20Scruggs--hmp4.htm,https://fzmovies.net/imdb_images/The.Ballad.of.Buster.Scruggs.2018.jpg
Musical,Hollywood,Rocketman,2019,BluRay,A musical fantasy about the fantastical human story of Elton John's breakthrough years. Tags : pianist | musician...<more>,https://fzmovies.net/movie-Rocketman--hmp4.htm,https://fzmovies.net/imdb_images/Rocketman.2019.jpg
Musical,Hollywood,Spirited,2022,WEB-DL,A musical version of Charles Dickens's story of a miserly misanthrope who is taken on a magical journey.Tags : christmas...<more>,https://fzmovies.net/movie-Spirited%20--hmp4.htm,https://fzmovies.net/imdb_images/Spirited.2022.jpg
Musical,Hollywood,Disenchanted,2022,WEB-DL,"Fifteen years after her happily ever after, Giselle questions her happiness, inadvertently turning the lives of those in the real world and Andalasia upside down in the process.Tags : second part | disney | princess...<more>",https://fzmovies.net/movie-Disenchanted--hmp4.htm,https://fzmovies.net/imdb_images/Disenchanted.2022.jpg
Musical,Hollywood,UglyDolls,2019,BluRay,"The free-spirited UglyDolls confront what it means to be different, struggle with their desire to be loved, and ultimately discover that you don't have to be perfect to be amazing because who you truly are is what matters most. Written by STXfilms...<more>",https://fzmovies.net/movie-UglyDolls--hmp4.htm,https://fzmovies.net/imdb_images/UglyDolls.2019.jpg
Musical,Hollywood,Phineas and Ferb the Movie Candace Against the Universe,2020,WEB-DL,"The famed stepbrother inventors know what they're gonna do today. They're gonna rescue their sister from an alien abduction.
Tags : abduction | alien...<more>",https://fzmovies.net/movie-Phineas%20and%20Ferb%20the%20Movie%20Candace%20Against%20the%20Universe--hmp4.htm,https://fzmovies.net/imdb_images/Phineas.and.Ferb.The.Movie.Candace.Against.the.Universe.2020.jpg
Musical,Hollywood,Mamma Mia!,2008,BluRay,The story of a bride-to-be trying to find her real father told using hit songs by the popular '70s group ABBA.,https://fzmovies.net/movie-Mamma%20Mia!--hmp4.htm,https://fzmovies.net/imdb_images/Mamma.Mia.2008.jpg
Musical,Hollywood,The Little Mermaid 2 Return to the Sea,2000,BluRay,"After having found a magic locket which shows the kingdom of Atlantica, Melody decides to run away from home and find the truth behind it. Ariel eventually discovers that her daughter has run away after being told by Sebastian. Ariel must turn back into a mermaid to go into the sea once more to…Tags : mermaid...<more>",https://fzmovies.net/movie-The%20Little%20Mermaid%202%20Return%20to%20the%20Sea--hmp4.htm,https://fzmovies.net/imdb_images/The.Little.Mermaid.2.Return.to.the.Sea.2000.jpg
Musical,Hollywood,Joker - Folie a Deux,2024,WEBRip,"Arthur Fleck is institutionalized at Arkham, awaiting trial for his crimes as Joker. While struggling with his dual identity, Arthur not only stumbles upon true love, but also finds the music that's always been inside him.Tags : sequel | violence | singing...<more>",https://fzmovies.net/movie-Joker%20-%20Folie%20a%20Deux--hmp4.htm,https://fzmovies.net/imdb_images/Joker.Folie.a.Deux.2024.jpg
Musical,Hollywood,Monster High - The Movie,2022,WEB-DL,"Follows a half human and half werewolf, as she finally finds a place where she fits, but, when a devious plan to destroy Monster High threatens to reveal her identity, she must learn to embrace her true monster heart and save the ......<more>",https://fzmovies.net/movie-Monster%20High%20-%20The%20Movie--hmp4.htm,https://fzmovies.net/imdb_images/Monster.High.2022.jpg
Musical,Hollywood,Sneakerella,2022,WEB-DL,A modern twist on Cinderella set in New York City's Sneaker culture.Tags : disney | dance | singing...<more>,https://fzmovies.net/movie-Sneakerella--hmp4.htm,https://fzmovies.net/imdb_images/Sneakerella.2022.jpg
