genre,category,title,year,distribution,description,url,cover_photo
Music,Hollywood,The Lion King 2019,2019,BluRay,"After the murder of his father, a young lion prince flees his kingdom only to learn the true meaning of responsibility and bravery.",https://fzmovies.net/movie-The%20Lion%20King%202019--hmp4.htm,https://fzmovies.net/imdb_images/The.Lion.King.2019.jpg
Music,Hollywood,Aladdin,2019,BluRay,A kindhearted street urchin and a power-hungry Grand Vizier vie for a magic lamp that has the power to make their deepest wishes come true.,https://fzmovies.net/movie-Aladdin--hmp4.htm,https://fzmovies.net/imdb_images/Aladdin.2019.jpg
Music,Hollywood,Frozen 2,2019,BluRay,"Anna, Elsa, Kristoff, Olaf and Sven leave Arendelle to travel to an ancient, autumn-bound forest of an enchanted land. They set out to find the origin of Elsa's powers in order to save their kingdom....<more>",https://fzmovies.net/movie-Frozen%202--hmp4.htm,https://fzmovies.net/imdb_images/Frozen.2.2019.jpg
Music,Hollywood,Encanto,2021,BluRay,A young Colombian girl has to face the frustration of being the only member of her family without magical powers.Tags : cgi animation...<more>,https://fzmovies.net/movie-Encanto--hmp4.htm,https://fzmovies.net/imdb_images/Encanto.2021.jpg
Music,Hollywood,The Little Mermaid 2023,2023,BluRay,A young mermaid makes a deal with a sea witch to trade her beautiful voice for human legs so she can discover the world above water and impress a prince....<more>,https://fzmovies.net/movie-The%20Little%20Mermaid%202023--hmp4.htm,https://fzmovies.net/imdb_images/The.Little.Mermaid.2023.jpg
Music,Hollywood,Baby Driver 2017,2017,BluRay,"After being coerced into working for a crime boss, a young getaway driver finds himself taking part in a heist doomed to fail.",https://fzmovies.net/movie-Baby%20Driver%202017--hmp4.htm,https://fzmovies.net/imdb_images/Baby.Driver.2017.jpg
Music,Hollywood,The Lion King,1994,BluRay,"A lion prince, Simba, is born in Africa and the animals of the Pride Lands pay tribute. Later Simba is told by his father, King Mufasa, that when Mufasa dies, Simba will become King of the Pride Lands. Simba's Uncle Scar would have been king after Musafa had Mufasa not had a child. Fuelled by rage, Scar plots to kill Mufasa and Simba so he is able to take over the throne. He uses the hyenas to cause a stampede through the canyon where Mufasa and Simba are, and personally ensures Mufasa falls to his death. Simba survives so Scar implies that the stampede was Simba's fault and that the pride will blame him. Simba flees the Pride Lands meaning never to return home. Simba is found, collapsed with exhaustion, by Timone the Meerkat, and Pummba the Warthog, and the trio become fast friends. Simba stays with them well into adulthood until his childhood friend, Nala, hunting beyond the Pride Lands that herds had deserted under Scar's mismanagement stumbles upon Simba's new home. Astonished to find him alive, she begs him to return to the Pride Lands, where Scar has reigned as King for years, and ruined everything. All of the animals will starve if Simba does not return. Simba eventually agrees to fight for his kingdom. Simba battles Scar, and learns his father's death was Scar's fault, not his own. Simba prevails and, in time, has his own son, mirroring ""The Circle of Life."" ...<more>",https://fzmovies.net/movie-The%20Lion%20King--hmp4.htm,https://fzmovies.net/imdb_images/The%20Lion%20King.jpg
Music,Hollywood,Sing 2,2021,BluRay,Buster Moon and his friends must persuade reclusive rock star Clay Calloway to join them for the opening of a new show.Tags : second part...<more>,https://fzmovies.net/movie-Sing%202--hmp4.htm,https://fzmovies.net/imdb_images/Sing.2.2021.jpg
Music,Hollywood,Trolls World Tour,2020,BluRay,"Poppy and Branch discover that they are but one of six different Troll tribes scattered over six different lands devoted to six different kinds of music: Funk, Country, Techno, Classical, Pop and Rock. Their world is about to get a lot bigger and a whole lot louder. A member of hard-rock royalty,…Tags : sequel | dancing | singing...<more>",https://fzmovies.net/movie-Trolls%20World%20Tour--hmp4.htm,https://fzmovies.net/imdb_images/Trolls.World.Tour.2020.jpg
Music,Hollywood,Pitch Perfect 2,2015,BluRay,"After a humiliating command performance at Lincoln Center, the Barden Bellas enter an international competition that no American group has ever won in order to regain their status and right to perform....<more>",https://fzmovies.net/movie-Pitch%20Perfect%202--hmp4.htm,https://fzmovies.net/imdb_images/Pitch.Perfect.2.jpg
Music,Hollywood,Step Up Revolution,2012,BluRay,"The Mob sets the dancing against the vibrant backdrop of Miami. Emily arrives in Miami with aspirations of becoming a professional dancer and soon falls in love with Sean, a young man who leads a dance crew in elaborate, cutting-edge flash mobs, called ""The Mob"". When a wealthy business man threatens to develop The Mob's historic neighborhood and displace thousands-of people, Emily must work together with Sean and The Mob to turn their performance art into protest art, and risk losing their dreams to fight for a greater cause. ...<more>",https://fzmovies.net/movie-Step%20Up%20Revolution--hmp4.htm,https://fzmovies.net/imdb_images/Step%20Up%20Revolution.jpg
Music,Hollywood,A Star Is Born 2018,2018,BluRay,"Seasoned musician Jackson Maine (Bradley Cooper) discovers-and falls in love with-struggling artist Ally (Gaga). She has just about given up on her dream to make it big as a singer - until Jack coaxes her into the spotlight. But even as Ally's career takes off, the personal side of their…...<more>",https://fzmovies.net/movie-A%20Star%20Is%20Born%202018--hmp4.htm,https://fzmovies.net/imdb_images/A.Star.Is.Born.2018.jpg
Music,Hollywood,Beauty and the Beast 2017,2017,BluRay,An adaptation of the fairy tale about a monstrous-looking prince and a young woman who fall in love.,https://fzmovies.net/movie-Beauty%20and%20the%20Beast%202017--hmp4.htm,https://fzmovies.net/imdb_images/Beauty.And.The.Beast.2017.jpg
Music,Hollywood,TANGLED,2010,BluRay,"The magically long-haired Rapunzel has spent her entire life in a tower, but now that a runaway thief has stumbled upon her, she is about to discover the world for the first time, and who she really is....<more>",https://fzmovies.net/movie-TANGLED--hmp4.htm,https://fzmovies.net/imdb_images/TANGLED.jpg
Music,Hollywood,Soul,2020,BluRay,"Joe is a middle-school band teacher whose life hasn't quite gone the way he expected. His true passion is jazz -- and he's good. But when he travels to another realm to help someone find their passion, he soon discovers what it means to have soul....<more>",https://fzmovies.net/movie-Soul--hmp4.htm,https://fzmovies.net/imdb_images/Soul.2020.jpg
Music,Hollywood,Pitch Perfect 3,2017,BluRay,"Following their win at the world championship, the now separated Bellas reunite for one last singing competition at an overseas USO tour, but face a group who uses both instruments and voices.
...<more>",https://fzmovies.net/movie-Pitch%20Perfect%203--hmp4.htm,https://fzmovies.net/imdb_images/Pitch.Perfect.3.2017.jpg
Music,Hollywood,The Greatest Showman,2017,BluRay,"Celebrates the birth of show business, and tells of a visionary who rose from nothing to create a spectacle that became a worldwide sensation.",https://fzmovies.net/movie-The%20Greatest%20Showman--hmp4.htm,https://fzmovies.net/imdb_images/The.Greatest.Showman.2017.jpg
Music,Hollywood,Alvin and the Chipmunks: Chipwrecked,2011,BDRip,"Playing around while aboard a cruise ship, the Chipmunks and Chipettes accidentally go overboard and end up marooned in a tropical paradise. They discover their new turf is not as deserted as it seems....<more>",https://fzmovies.net/movie-Alvin%20and%20the%20Chipmunks:%20Chipwrecked--hmp4.htm,https://fzmovies.net/imdb_images/Alvin%20and%20the%20Chipmunks:%20Chipwrecked.jpg
Music,Hollywood,Straight Outta Compton,2015,BluRay,"The group NWA emerges from the mean streets of Compton in Los Angeles, California, in the mid-1980s and revolutionizes Hip Hop culture with their music and tales about life in the hood....<more>",https://fzmovies.net/movie-Straight%20Outta%20Compton--hmp4.htm,https://fzmovies.net/imdb_images/Straight.Outta.Compton.jpg
Music,Hollywood,Pitch Perfect,2012,BluRay,"The Barden Bellas are a collegiate, all-girls a cappella singing group thriving on female pop songs and their perfect looks. After a disastrous failing at last year's finals, they are forced to regroup. Among the new recruits is freshman Beca, an independent, aspiring DJ with no interest in the college life. But after she meets Jesse, from the rival all-male a cappella group, Beca has a new outlook and takes it upon herself to help the Bellas find their new look and sound and get back into the competition. ...<more>",https://fzmovies.net/movie-Pitch%20Perfect--hmp4.htm,https://fzmovies.net/imdb_images/Pitch%20Perfect.jpg
Music,Hollywood,High School Musical,2006,BluRay,"Troy Bolton and Gabriella Montez are two totally different teenagers who meet at a party while singing karaoke on New Year's Eve. One week later Troy goes back to his high school, East High, in New Mexico to find that Gabriella is a new student there. They quickly become close friends and accidentally audition for the school musical. After getting a callback, drama queen Sharpay Evans and her sidekick brother Ryan are furious. Then Chad, Troy's best friend and basketball teammate, and Taylor, Gabriella's new friend on the decathlon team, must find out a way to make Gabriella hate Troy. ...<more>",https://fzmovies.net/movie-High%20School%20Musical--hmp4.htm,https://fzmovies.net/imdb_images/High%20School%20Musical.jpg
Music,Hollywood,Purple Hearts,2022,WEB-DL,"In spite of their many differences, Cassie, a struggling singer-songwriter, and Luke, a troubled Marine, agree to marry solely for military benefits. But when tragedy strikes, the line between real and pretend begins to blur.Tags : love | singer | two word title | color in title...<more>",https://fzmovies.net/movie-Purple%20Hearts--hmp4.htm,https://fzmovies.net/imdb_images/Purple.Hearts.2022.jpg
Music,Hollywood,8 Mile,2002,BluRay,"A young rapper, struggling with every aspect of his life, wants to make it big but his friends and foes make this odyssey of rap harder than it may seem. ...<more>",https://fzmovies.net/movie-8%20Mile--hmp4.htm,https://fzmovies.net/imdb_images/8.Mile.2002.jpg
Music,Hollywood,The Lion King II: Simbas Pride,1998,BluRay,"Simba and Nala have a daughter, Kiara. Timon and Pumbaa are assigned to be her babysitters, but she easily escapes their care and ventures into the forbidden lands. There she meets a lion cub named Kovu and they become friends. What she and her parents do not know is that Kovu is the son of Zira - a banished follower of the now-dead Scar. She plans to raise Kovu to overthrow Simba and become the king of the Pride Lands. This tests not only Kiara and Kovu's relationship as they mature, but Simba's relationship with his daughter. ...<more>",https://fzmovies.net/movie-The%20Lion%20King%20II:%20Simbas%20Pride--hmp4.htm,https://fzmovies.net/imdb_images/The%20Lion%20King%20II:%20Simbas%20Pride.jpg
Music,Hollywood,Descendants 3,2019,WEBRip,The teenagers of Disney's most infamous villains return to the Isle of the Lost to recruit a new batch of villainous offspring to join them at Auradon Prep. ...<more>,https://fzmovies.net/movie-Descendants%203--hmp4.htm,https://fzmovies.net/imdb_images/Descendants.3.2019.jpg
Music,Hollywood,High School Musical 2,2007,BluRay,"The Wildcats are back. They start off getting out of school, where Sharpay makes sure Troy has job at her country club. Troy then in returns gets everyone else a job at the country club too. Gabriella is the new lifeguard, while Troy, Chad, and the others work in the kitchen. At the country club there is a talent show, which Sharpay and Ryan win every year. Kelsi had written a song for Troy and Gabriella to sing at the talent show, which later on Sharpay takes (at a faster tempo) for her and Troy to sing at the talent show. Sharpay plots to take Troy away from Gabriella, by getting him a better job than the rest of the Wildcats. Troy starts changing, all for a ""scholarship"", starting to act like a jerk, which results in Gabriella breaking up with Troy, saying she doesn't belong there. After Troy loses all his friends, because he began acting like a jerk and had found out that Sharpay had made it where no Junior Staffers can perform in the talent show, he decides to do something about it, and asks for his old job back with the rest of his friends and quits the talent show leaving Sharpay with nothing, since she had ditched her brother to perform with Troy. She then goes back to Ryan, who had been working with the Junior Staffers on an act, who then leaves her saying she always wanted the spotlight, now she has it. Troy ends up doing the talent show, thinking that he would be performing with Sharpay. He learns a new song within a matter of minutes. ...<more>",https://fzmovies.net/movie-High%20School%20Musical%202--hmp4.htm,https://fzmovies.net/imdb_images/High%20School%20Musical%202.jpg
Music,Hollywood,School Dance,2014,WEB-DL,"High schooler Jason has found his dream girl-the gorgeous Anastacia. There's just one problem: she doesn't know he exists. If he can win a spot on the school's hottest dance crew, Jason ... ...<more>",https://fzmovies.net/movie-School%20Dance--hmp4.htm,https://fzmovies.net/imdb_images/School%20Dance.2014.jpg
Music,Hollywood,Smallfoot,2018,BluRay,"A yeti named Migo is convinced that a human known only as ""Small Foot"" is real and has to prove to his tribe that it does exist with the help of Meechee and the S.E.S - Smallfoot Evidentiary Society. Written by Mark Mason RobledoTags : cgi...<more>",https://fzmovies.net/movie-Smallfoot--hmp4.htm,https://fzmovies.net/imdb_images/Smallfoot.2018.jpg
Music,Hollywood,Step Up All In,2014,BluRay,"All-stars from the previous Step Up installments come together in glittering Las Vegas, battling for a victory that could define their dreams and their careers...<more>",https://fzmovies.net/movie-Step%20Up%20All%20In--hmp4.htm,https://fzmovies.net/imdb_images/Step.Up.All.In.2014.jpg
Music,Hollywood,Forever My Girl 2018,2018,BluRay,After being gone for a decade a country star returns home to the love he left behind.,https://fzmovies.net/movie-Forever%20My%20Girl%202018--hmp4.htm,https://fzmovies.net/imdb_images/Forever.My.Girl.2018.jpg
Music,Hollywood,High School Musical 3: Senior Year,2008,BluRay,"Troy and the gang of East High School are going through their senior year, facing graduating and going their separate ways. Coming to terms with the reality of it all, Troy wants to attend the nearby University of Albuquerque next year on a basketball scholarship, but Gabriella wants to attend Stanford University in California. Meanwhile, Sharpay, the school's shallow and spoiled rich girl, plots to go all out planning the school's final musical show with the idea to add music to her hopes and fears about the future. While Sharpay takes an up-and-coming British exchange student under her wing, her flamboyant fraternal twin brother, Ryan, has his sights set on something different after school. In addition, Troy's best friend and basketball teammate Chad, and Garbiella's best friend Taylor, all have their sights set on their plans after high school and come to terms with the reality of the real world. ...<more>",https://fzmovies.net/movie-High%20School%20Musical%203:%20Senior%20Year--hmp4.htm,https://fzmovies.net/imdb_images/High%20School%20Musical%203:%20Senior%20Year.jpg
Music,Hollywood,Green Book,2018,BluRay,"In 1962, Tony ""Tony Lip"" Vallelonga, a tough bouncer, is looking for work with his nightclub is closed for renovations. The most promising offer turns out to be the driver for the African-American classical pianist Don Shirley for a concert tour into the Deep South states. Although hardly enthused…...<more>",https://fzmovies.net/movie-Green%20Book--hmp4.htm,https://fzmovies.net/imdb_images/Green.Book.2018.jpg
Music,Hollywood,Stomp the Yard,2007,BluRay,"After the death of his brother, an expert street dancer goes to Georgia to attend Truth University. But his efforts to get an education and woo the girl he likes are sidelined when he joins......<more>",https://fzmovies.net/movie-Stomp%20the%20Yard--hmp4.htm,https://fzmovies.net/imdb_images/Stomp.the.Yard.2007.jpg
Music,Hollywood,All Eyez on Me 2017,2017,BluRay,"Tells the true and untold story of prolific rapper, actor, poet and activist Tupac Shakur.",https://fzmovies.net/movie-All%20Eyez%20on%20Me%202017--hmp4.htm,https://fzmovies.net/imdb_images/All.Eyez.on.Me.2017.jpg
Music,Hollywood,The Princess and the Frog,2008,BluRay,"A modern day retelling of the classic story The Frog Prince. The Princess and the Frog finds the lives of arrogant, carefree Prince Naveen and hardworking waitress Tiana crossing paths. Prince Naveen is transformed into a frog by a conniving voodoo magician and Tiana, following suit, upon kissing the amphibian royalty. With the help of a trumpet-playing alligator, a Cajun firefly, and an old blind lady who lives in a boat in a tree, Naveen and Tiana must race to break the spell and fulfill their dreams. ...<more>",https://fzmovies.net/movie-The%20Princess%20and%20the%20Frog--hmp4.htm,https://fzmovies.net/imdb_images/The%20Princess%20and%20the%20Frog.jpg
Music,Hollywood,Cinderella 2021,2021,BluRay,"A modern movie musical with a bold take on the classic fairy tale. Our ambitious heroine has big dreams and with the help of her fab Godmother, she perseveres to make them come true.Tags : fairy | fairy tale | magic...<more>",https://fzmovies.net/movie-Cinderella%202021--hmp4.htm,https://fzmovies.net/imdb_images/Cinderella.2021.jpg
Music,Hollywood,I Still Believe,2020,BluRay,The true-life story of Christian music star Jeremy Camp and his journey of love and loss that looks to prove there is always hope.,https://fzmovies.net/movie-I%20Still%20Believe--hmp4.htm,https://fzmovies.net/imdb_images/I.Still.Believe.2020.jpg
Music,Hollywood,Bohemian Rhapsody,2018,BluRay,"Bohemian Rhapsody is a foot-stomping celebration of Queen, their music and their extraordinary lead singer Freddie Mercury. Freddie defied stereotypes and shattered convention to become one of the most beloved entertainers on the planet. The film traces the meteoric rise of the band through their…Tags : gay...<more>",https://fzmovies.net/movie-Bohemian%20Rhapsody--hmp4.htm,https://fzmovies.net/imdb_images/Bohemian.Rhapsody.2018.jpg
Music,Hollywood,Honey Rise Up and Dance 2018,2018,BluRay,Aspiring street dancer Skyler (Teyana Taylor) is at a major crossroads in her life. She's decided to try-out for the same dance crew as her formally trained sister Tosha (Sierra McClain) in... ...<more>,https://fzmovies.net/movie-Honey%20Rise%20Up%20and%20Dance%202018--hmp4.htm,https://fzmovies.net/imdb_images/Honey.Rise.Up.and.Dance.2018.jpg
Music,Hollywood,The Lego Movie 2 The Second Part,2019,BluRay,"It's been five years since everything was awesome and the citizens are facing a huge new threat: Lego Duplo invaders from outer space, wrecking everything faster than they can rebuild. Tags : toy | sequel...<more>",https://fzmovies.net/movie-The%20Lego%20Movie%202%20The%20Second%20Part%20--hmp4.htm,https://fzmovies.net/imdb_images/The.Lego.Movie.2.2019.jpg
Music,Hollywood,Battle of the Year,2013,BluRay,"Battle of the Year attracts all the best teams from around the world, but the Americans haven't won in fifteen years. Dante enlists Blake to assemble a team of the best dancers and bring the Trophy back to America where it started....<more>",https://fzmovies.net/movie-Battle%20of%20the%20Year--hmp4.htm,https://fzmovies.net/imdb_images/Battle%20of%20the%20Year.jpg
Music,Hollywood,Mary Poppins Returns,2018,BluRay,"In Depression-era London, a now-grown Jane and Michael Banks, along with Michael's three children, are visited by the enigmatic Mary Poppins following a personal loss. Through her unique magical skills, and with the aid of her friend Jack, she helps the family rediscover the joy and wonder missing…Tags : nanny | father | sister...<more>",https://fzmovies.net/movie-Mary%20Poppins%20Returns--hmp4.htm,https://fzmovies.net/imdb_images/Mary.Poppins.Returns.2018.jpg
Music,Hollywood,9 Songs 2004,2004,BluRay,"In London, England, love blooms between an American college student, named Lisa, and a British glaciologist, named Matt, where over the next few months in between attending rock concerts, the two lovers have intense sexual encounters. ...<more>",https://fzmovies.net/movie-9%20Songs%202004--hmp4.htm,https://fzmovies.net/imdb_images/9.Songs.2004.jpg
Music,Hollywood,La La Land 2016,2016,BluRay,A jazz pianist falls for an aspiring actress in Los Angeles.,https://fzmovies.net/movie-La%20La%20Land%202016--hmp4.htm,https://fzmovies.net/imdb_images/La.La.Land.2016.jpg
Music,Hollywood,Marry Me,2022,BluRay,"Music superstars Kat Valdez and Bastian are getting married before a global audience of fans. But when Kat learns, seconds before her vows, that Bastian has been unfaithful, she decides to marry Charlie, a stranger in the crowd, instTags : wedding | marriage proposal...<more>",https://fzmovies.net/movie-Marry%20Me--hmp4.htm,https://fzmovies.net/imdb_images/Marry.Me.2022.jpg
Music,Hollywood,Joyful Noise,2012,BluRay,"G.G. Sparrow faces off with her choir's newly appointed director, Vi Rose Hill, over the group's direction as they head into a national competition.",https://fzmovies.net/movie-Joyful%20Noise--hmp4.htm,https://fzmovies.net/imdb_images/Joyful%20Noise.jpg
Music,Hollywood,Happy Feet Two,2011,BluRay,"Mumble's son, Erik, is struggling to realize his talents in the Emperor Penguin world. Meanwhile, Mumble and his family and friends discover a new threat their home -- one that will take everyone working together to save them....<more>",https://fzmovies.net/movie-Happy%20Feet%20Two--hmp4.htm,https://fzmovies.net/imdb_images/Happy%20Feet%20Two.jpg
Music,Hollywood,Notorious 2009,2009,BluRay,"The life and death story of Notorious B.I.G. (a.k.a. Christopher Wallace), who came straight out of Brooklyn to take the world of rap music by storm.",https://fzmovies.net/movie-Notorious%202009--hmp4.htm,https://fzmovies.net/imdb_images/Notorious.2009.jpg
Music,Hollywood,Step Up 3D,2010,BluRay,A tight-knit group of New York City street dancers find themselves pitted against the world's best hip hop dancers in a high-stakes showdown.,https://fzmovies.net/movie-Step%20Up%203D--hmp4.htm,https://fzmovies.net/imdb_images/Step.Up.3.2010.jpg
Music,Hollywood,Over the Moon,2020,WEB-DL,"In this animated musical, a girl builds a rocket ship and blasts off, hoping to meet a mythical moon goddess.
Tags : girl...<more>",https://fzmovies.net/movie-Over%20the%20Moon--hmp4.htm,https://fzmovies.net/imdb_images/Over.the.Moon.2020.jpg
Music,Hollywood,Step Up 2 The Streets 2008,2008,BluRay,Romantic sparks occur between two dance students from different backgrounds at the Maryland School of the Arts.,https://fzmovies.net/movie-Step%20Up%202%20The%20Streets%202008--hmp4.htm,https://fzmovies.net/imdb_images/step.up.2.the.streets.2008.jpg
Music,Hollywood,The Prince of Egypt,1997,BluRay,"This is the extraordinary tale of two brothers named Moses and Ramses, one born of royal blood, and one an orphan with a secret past. Growing up the best of friends, they share a strong bond of free-spirited youth and good-natured rivalry. But the truth will ultimately set them at odds, as one becomes the ruler of the most powerful empire on earth, and the other the chosen leader of his people! Their final confrontation will forever change their lives and the world. ...<more>",https://fzmovies.net/movie-The%20Prince%20of%20Egypt--hmp4.htm,https://fzmovies.net/imdb_images/The%20Prince%20of%20Egypt.jpg
Music,Hollywood,Vivo,2021,BluRay,"Vivo, Sony Pictures Animation's first-ever musical adventure featuring all-new original songs from Lin-Manuel Miranda, will take audiences on an epic adventure to gorgeous and vibrant locations never before seen in animation.Tags : epic | cgi animation | singing...<more>",https://fzmovies.net/movie-Vivo--hmp4.htm,https://fzmovies.net/imdb_images/Vivo.2021.jpg
Music,Hollywood,Romance and Cigarettes,2006,BluRay,"A down-and-dirty musical set in the world of working-class New York, tells a story of a husband's journey into infidelity and redemption when he must choose between his seductive mistress and his beleaguered wife.
A down-and-dirty musical set in the world of working-class New York, tells a story of a husband's journey into infidelity and redemption when he must choose between his seductive mistress and his beleaguered wife.
...<more>",https://fzmovies.net/movie-Romance%20and%20Cigarettes--hmp4.htm,https://fzmovies.net/imdb_images/Romance.and.Cigarettes.2005.jpg
Music,Hollywood,Camp Rock,2008,BluRay,"""Camp Rock"" centers on a teen girl who desperately wants to spend her summer at a prestigious rock camp, but can only attend if she works in the kitchen as one of the cooks. When she's overheard singing - but not seen -- by a teen pop star at the camp, he is completely taken and sets out to find the girl behind the beautiful voice. But first she must confront her fears, step out of the kitchen and into the spotlight. ...<more>",https://fzmovies.net/movie-Camp%20Rock--hmp4.htm,https://fzmovies.net/imdb_images/Camp%20Rock.jpg
Music,Hollywood,Bodied,2018,HDRip,A progressive graduate student finds success and sparks outrage when his interest in battle rap as a thesis subject becomes a competitive obsession.,https://fzmovies.net/movie-Bodied--hmp4.htm,https://fzmovies.net/imdb_images/Bodied.2018.jpg
