genre,category,title,year,distribution,description,url,cover_photo
Music,Hollywood,Pump Up the Volume,1990,BluRay,"Mark is an intelligent but shy teenager who has just moved to Arizona from the East Coast. His parents give him a short-wave radio so he can talk to his pals, but instead he sets up shop as pirate deejay Hard Harry, who becomes a hero to his peers while inspiring the wrath of the local high school…...<more>",https://fzmovies.net/movie-Pump%20Up%20the%20Volume--hmp4.htm,https://fzmovies.net/imdb_images/Pump.Up.the.Volume.1990.jpg
Music,Hollywood,Paint Your Wagon,1969,BluRay,"A Michigan farmer and a prospector form a partnership in the California gold country. Their adventures include buying and sharing a wife, hijacking a stage, kidnaping six prostitutes, and turning their mining camp into a boomtown. Along the way there is plenty of drinking, gambling, and singing.Tags : gold | california...<more>",https://fzmovies.net/movie-Paint%20Your%20Wagon%20--hmp4.htm,https://fzmovies.net/imdb_images/Paint.Your.Wagon.1969.jpg
Music,Hollywood,The Cotton Club 1984,1984,BluRay,"The Cotton Club was a famous night club in Harlem. The story follows the people that visited the club, those that ran it, and is peppered with the Jazz music that made it so famous. ...<more>",https://fzmovies.net/movie-The%20Cotton%20Club%201984--hmp4.htm,https://fzmovies.net/imdb_images/The.Cotton.Club.1984.jpg
Music,Hollywood,A StoryBots Christmas,2017,WEBRip,"When Bo mistakenly thinks that her friends don't like her gifts, she heads to the North Pole to ask Santa for help making better presents. She learns along the way that Christmas is about far more than just the toys.
...<more>",https://fzmovies.net/movie-A%20StoryBots%20Christmas--hmp4.htm,https://fzmovies.net/imdb_images/a.storybots.christmas.2017.jpg
Music,Hollywood,The Land Before Time 6 The Secret of Saurus Rock,1998,WEB-DL,"Grandpa tells Littlefoot about their mythical hero called the Lone Dinosaur. Sarah gets two little lively cousins to take care of. Later, the kids accidentally chip the lucky Saurus Rock, and need to fix it before the bad luck hits. Tags : hero | dinosaur | sequel...<more>",https://fzmovies.net/movie-The%20Land%20Before%20Time%206%20The%20Secret%20of%20Saurus%20Rock--hmp4.htm,https://fzmovies.net/imdb_images/The.Land.Before.Time.VI.The.Secret.of.Saurus.Rock.1998.jpg
Music,Hollywood,The Pop Out Ken and Friends,2024,WEBRip,"Celebrate an incredible performance from Kendrick Lamar and special guests. Live on Juneteenth, 2024 from the historic Los Angeles Forum in Inglewood, CA....<more>",https://fzmovies.net/movie-The%20Pop%20Out%20Ken%20and%20Friends--hmp4.htm,https://fzmovies.net/imdb_images/The.Pop.Out.Ken.and.Friends.2024.jpg
Music,Hollywood,Vox Lux,2018,BluRay,"Vox Lux follows the rise of Celeste from the ashes of a major national tragedy to pop super stardom. The film spans 18 years and traces important cultural moments through her eyes, starting in 1999 and concluding in 2017. In 1999, teenage Celeste (Raffey Cassidy) survives a violent tragedy. After…...<more>",https://fzmovies.net/movie-Vox%20Lux--hmp4.htm,https://fzmovies.net/imdb_images/Vox.Lux.2018.jpg
Music,Hollywood,Innerself,2018,WEBRip,Naive Ed trying to prove to everyone he's a great Kung Fu Master while learning through life that it is never black and white when being bullied.,https://fzmovies.net/movie-Innerself--hmp4.htm,https://fzmovies.net/imdb_images/Innerself.2018.jpg
Music,Hollywood,Jack and the Beanstalk 1967,1967,DVDRip,"The adventure begins when Jack trades his cow for some magic beans from peddler Jeremy Keen. The beans sprout a beanstalk high into the clouds, and Jack and Jeremy climb it to discover a giant, a goose that lays golden eggs, and Princess Serena who is trapped in a harp by a magic spell and can only…Tags : dancing | magic...<more>",https://fzmovies.net/movie-Jack%20and%20the%20Beanstalk%201967--hmp4.htm,https://fzmovies.net/imdb_images/Jack.and.the.Beanstalk.1967.jpg
Music,Hollywood,Leprechaun 5 - In the Hood,2000,BluRay,"When three rappers want to get even with a pimp, they accidentally unleash a leprechaun who goes on a killing rampage in tha 'hood.Tags : spoof | home invasion...<more>",https://fzmovies.net/movie-Leprechaun%205%20-%20In%20the%20Hood--hmp4.htm,https://fzmovies.net/imdb_images/Leprechaun.5.In.the.Hood.2000.jpg
Music,Hollywood,Rugrats Go Wild,2003,BluRay,"The Rugrats get tangled in an exotic adventure, where they're helped by the Thornberrys, a family that travels the world making nature documentaries.Tags : child...<more>",https://fzmovies.net/movie-Rugrats%20Go%20Wild--hmp4.htm,https://fzmovies.net/imdb_images/Rugrats.Go.Wild.2003.jpg
Music,Hollywood,A Chance Encounter,2022,WEBRip,"In the Sicilian town of Taormina, Italy, an aspiring poet in search of inspiration meets a folk singer trying to write a follow up to her breakout hit.Tags : singer...<more>",https://fzmovies.net/movie-A%20Chance%20Encounter--hmp4.htm,https://fzmovies.net/imdb_images/A.Chance.Encounter.2022.jpg
Music,Hollywood,The Song Remains the Same,1976,BluRay,"The members of Led Zeppelin are called back from vacation by manager Peter Grant to play Madison Square Garden. The film is enhanced by each of the band member's personal fantasies (hallucinations?), such as the opening scene (which is awfully confusing the first time around) in which Peter Grant, dressed in a 1930s black gangster suit drives a 1930s black Ford to a house and blasts everyone with a machine gun. ...<more>",https://fzmovies.net/movie-The%20Song%20Remains%20the%20Same--hmp4.htm,https://fzmovies.net/imdb_images/The%20Song%20Remains%20the%20Same.jpg
Music,Hollywood,Music of the Heart 1999,1999,DVDRip,Story of a schoolteacher's struggle to teach violin to inner-city Harlem kids.,https://fzmovies.net/movie-Music%20of%20the%20Heart%201999--hmp4.htm,https://fzmovies.net/imdb_images/Music.Of.The.Heart.1999.jpg
Music,Hollywood,A Prairie Home Companion 2006,2006,WEB-DL,"A look at what goes on backstage during the last broadcast of America's most celebrated radio show, where singing cowboys Dusty and Lefty, a country music siren, and a host of others hold court....<more>",https://fzmovies.net/movie-A%20Prairie%20Home%20Companion%202006--hmp4.htm,https://fzmovies.net/imdb_images/A.Prairie.Home.Companion.2006.jpg
Music,Hollywood,Snow White and the Three Stooges,1961,DVDRip,"Based on the classic fairy tale, Larry, Moe, and Curly Joe (the Three Stooges) substitute for the Seven Dwarfs while the princess Snow White (Olympic figure skating champion Carol Heiss) is forced to flee from her jealous stepmother, the queen (Patricia Medina), who takes drastic steps to insure…Tags : princess...<more>",https://fzmovies.net/movie-Snow%20White%20and%20the%20Three%20Stooges--hmp4.htm,https://fzmovies.net/imdb_images/Snow.White.and.the.Three.Stooges.1961.jpg
Music,Hollywood,Rockers 1980,1980,BluRay,"Horsemouth sets himself up in business selling records but when gangsters steal his bike things start to turn nasty. As tensions build, Horsemouth and friends plot to end the gangsters ......<more>",https://fzmovies.net/movie-Rockers%201980--hmp4.htm,https://fzmovies.net/imdb_images/Rockers.1978.jpg
Music,Hollywood,Snipes,2002,WEBRip,"Erik is an ambitious teenager who spends more time posting fliers for his favorite rapper, Prolifik, than sitting in the classroom. When he and his best friend stumble across a dead body one night, they trigger a series of tragic ...Tags : tied feet...<more>",https://fzmovies.net/movie-Snipes--hmp4.htm,https://fzmovies.net/imdb_images/Snipes.2001.jpg
Music,Hollywood,The Breaks,2016,HDTV,"Three friends united by their love of hip-hop work to make their big mark in the music industry. Beginning in the summer of 1990 NYC, Nikki a brilliant recent grad abandons a law school scholarship to pursue her dream of becoming a record exec along with the son of a legendary music producer…...<more>",https://fzmovies.net/movie-The%20Breaks--hmp4.htm,https://fzmovies.net/imdb_images/the.breaks.2016.jpg
Music,Hollywood,Fairy Tales,1978,BluRay,"On his twenty-first birthday, the Prince goes on a quest that takes him across the land searching for the one woman that gets him sexually excited, Princess Sleeping Beauty.Tags : erotica...<more>",https://fzmovies.net/movie-Fairy%20Tales--hmp4.htm,https://fzmovies.net/imdb_images/Fairy.Tales.1978.jpg
Music,Hollywood,The Producers 2005,2005,BluRay,"After putting together another Broadway flop, down-on-his-luck producer Max Bialystock teams up with timid accountant Leo Bloom in a get-rich-quick scheme to put on the world's worst show. ...<more>",https://fzmovies.net/movie-The%20Producers%202005--hmp4.htm,https://fzmovies.net/imdb_images/The.Producers.2005.jpg
Music,Hollywood,Bruno Mars 24K Magic Live at the Apollo,2017,WEB-DL,"CBS and Atlantic Records partnered with multiple Grammy Award-winning singer, songwriter, producer, director, musician and two-time Super Bowl Halftime performer Bruno Mars to premiere his first prime-time television special. The electrifying concert was taped at the legendary Apollo Theater in New…...<more>",https://fzmovies.net/movie-Bruno%20Mars%2024K%20Magic%20Live%20at%20the%20Apollo--hmp4.htm,https://fzmovies.net/imdb_images/Bruno.Mars.24K.Magic.Live.At.The.Apollo.2017.jpg
Music,Hollywood,I Am Woman,2019,BluRay,"1966. Helen Reddy arrives in New York with her three-year-old daughter, a suitcase and $230 in her pocket. She had been told she'd won a recording contract, but the record company promptly dashes her hopes by telling her it has enough female stars and suggests she has fun in New York before…...<more>",https://fzmovies.net/movie-I%20Am%20Woman--hmp4.htm,https://fzmovies.net/imdb_images/I_Am_Woman_2020.jpg
Music,Hollywood,Sunshine on Leith,2013,BluRay,Two soldiers return home to Edinburgh to resume their romantic and family lives.,https://fzmovies.net/movie-Sunshine%20on%20Leith%20--hmp4.htm,https://fzmovies.net/imdb_images/Sunshine.on.Leith.2013.jpg
Music,Hollywood,Im Not There,2007,BluRay,"Ruminations on the life of Bob Dylan, where six characters embody a different aspect of the musician's life and work.",https://fzmovies.net/movie-Im%20Not%20There--hmp4.htm,https://fzmovies.net/imdb_images/Im.Not.There.2007.jpg
Music,Hollywood,The Muppets Take Manhattan,1984,BluRay,"The Muppets graduate from college and decide to take their senior revue on the road. They hit the streets of Manhattan trying to sell their show to producers, finally finding one young and idealistic enough to take their show. After several mishaps and much confusion, things begin to come together…Tags : college | frog | cave...<more>",https://fzmovies.net/movie-The%20Muppets%20Take%20Manhattan--hmp4.htm,https://fzmovies.net/imdb_images/The.Muppets.Take.Manhattan.1984.jpg
Music,Hollywood,The Land Before Time 4 Journey Through the Mists,1996,WEBRip,"Littlefoot's grandfather is dreadfully ill and a golden flower is the only hope to cure him, but it lies within the land of the Mists so Littlefoot and his friends Cera, Ducky, Petrie, Spike and newcomer, Ali, journey through the mists to find it. Mayhem and danger await around every turn! Written…Tags : dinosaur | sequel...<more>",https://fzmovies.net/movie-The%20Land%20Before%20Time%204%20Journey%20Through%20the%20Mists--hmp4.htm,https://fzmovies.net/imdb_images/The.Land.Before.Time.IV.1996.jpg
Music,Hollywood,Across the Universe,2007,BluRay,"Across The Universe is a fictional love story set in the 1960s amid the turbulent years of anti-war protest, the struggle for free speech and civil rights, mind exploration and rock and roll. At once gritty, whimsical and highly theatrical, the story moves from high schools and universities in…...<more>",https://fzmovies.net/movie-Across%20the%20Universe--hmp4.htm,https://fzmovies.net/imdb_images/Across.the.Universe.2007.jpg
Music,Hollywood,Torn Hearts,2022,WEB-DL,Follows a country music duo who seek out the private mansion of their idol and end up in a twisted series of horrors that force them to confront the limits they'd go for their dreams....<more>,https://fzmovies.net/movie-Torn%20Hearts--hmp4.htm,https://fzmovies.net/imdb_images/Torn.Hearts.2022.jpg
Music,Hollywood,The Land Before Time 3 The Time of the Great Giving,1995,WEBRip,When a meteorite had trapped all their water supply Littlefield and the team (which is the young crew) set out to find a new source of water in which this forces them to leave their home and are being confronted by a gang of mean dinosaurs will they ever work together? Written by Marah durman.Tags : villain | betrayal...<more>,https://fzmovies.net/movie-The%20Land%20Before%20Time%203%20The%20Time%20of%20the%20Great%20Giving--hmp4.htm,https://fzmovies.net/imdb_images/The.Land.Before.Time.III.1995.jpg
Music,Hollywood,El Medico The Cubaton Story,2010,BluRay,"Two men struggle in Cuba. El Medico, a young Cuban doctor and musician, is trying to get a better life for his family. Michel, a European music producer, wants fame and fortune. It is a fight between two minds; One sees the music as an authentic expression of Cuban culture and history, the other sees it as a commercial product to be sold by any means necessary. Caught in this clash of views is also Coquita, the young dancer whose dreams are ruined because Michel thinks she is not sexy enough, and El Medico's Mother who thinks her son is betraying the revolutionary ideals that she suffered for. El Medico realizes that being Michel's product is not his dream, but he has to decide between doing his duty to the State, as a doctor fulfilling his mothers dream, or being an artist. ...<more>",https://fzmovies.net/movie-El%20Medico%20The%20Cubaton%20Story--hmp4.htm,https://fzmovies.net/imdb_images/El%20Medico%20The%20Cubaton%20Story.jpg
Music,Hollywood,That Thing You Do,1996,BluRay,"A local Pennsylvania band scores a one-hit wonder in 1964 and rides the star-making machinery as long as they can, with lots of help from their manager....<more>",https://fzmovies.net/movie-That%20Thing%20You%20Do--hmp4.htm,https://fzmovies.net/imdb_images/That.Thing.You.Do.1996.jpg
Music,Hollywood,The Nutcracker 2010,2010,BluRay,"1920s Vienna. Nine-year-old Mary lives in a home filled with lovely things and loneliness. Bothered by bratty brother Max and neglected by well intentioned, but distracted, parents, she yearns for companionship and adventure. On Christmas Eve, Mary's beloved Uncle Albert arrives with the gift of a…Tags : nazi | christmas...<more>",https://fzmovies.net/movie-The%20Nutcracker%202010--hmp4.htm,https://fzmovies.net/imdb_images/The.Nutcracker.2010.jpg
Music,Hollywood,Beats Rhymes and Life The Travels of A Tribe Called Quest,2011,BluRay,"Having forged a 20-year run as one of the most innovative and influential hip hop bands of all time, the Queens NY collective known as 'A Tribe Called Quest' have kept a generation hungry for more of their groundbreaking music since their much publicized breakup in 1998. Michael Rapaport documents…...<more>",https://fzmovies.net/movie-Beats%20Rhymes%20and%20Life%20The%20Travels%20of%20A%20Tribe%20Called%20Quest--hmp4.htm,https://fzmovies.net/imdb_images/Beats.Rhymes.and.Life.The.Travels.of.a.Tribe.Called.Quest.2011.jpg
Music,Hollywood,Earth Girls Are Easy,1990,WEBRip,A Southern California girl befriends three furry aliens after their spaceship lands in her swimming pool.Tags : alien...<more>,https://fzmovies.net/movie-Earth%20Girls%20Are%20Easy--hmp4.htm,https://fzmovies.net/imdb_images/Earth.Girls.Are.Easy.1988.jpg
Music,Hollywood,American Dreamz,2006,BluRay,"The new season of ""American Dreamz,"" the wildly popular television singing contest, has captured the country's attention, as the competition looks to be between a young Midwestern gal (Moore) and a showtunes-loving young man from Orange County (Golzari). Recently awakened President Staton (Quaid) even wants in on the craze, as he signs up for the potential explosive season finale....<more>",https://fzmovies.net/movie-American%20Dreamz%20--hmp4.htm,https://fzmovies.net/imdb_images/American.Dreamz.2006.jpg
Music,Hollywood,Sid and Nancy,1986,BluRay,"Morbid biographical story of Sid Vicious, bassist with British punk group the Sex Pistols, and his girlfriend Nancy Spungen. When the Sex Pistols break up after their fateful US tour, Vicious attempts a solo career while in the grip of heroin addiction. One morning, Nancy is found stabbed to death…...<more>",https://fzmovies.net/movie-Sid%20and%20Nancy--hmp4.htm,https://fzmovies.net/imdb_images/Sid.and.Nancy.1986.jpg
Music,Hollywood,SLC Punk,1999,WEBRip,In the early 1980s Stevo and Heroin Bob are the only two dedicated punks in conservative Salt Lake City.Tags : breaking the fourth wall | hospital...<more>,https://fzmovies.net/movie-SLC%20Punk--hmp4.htm,https://fzmovies.net/imdb_images/SLC.Punk.1998.jpg
Music,Hollywood,Suck,2010,BluRay,A comedy centered on a rock 'n' roll band that will do anything to become famous.,https://fzmovies.net/movie-Suck%20--hmp4.htm,https://fzmovies.net/imdb_images/Suck.2009.jpg
Music,Hollywood,Worlds Best,2023,WEB-DL,"Follows Raj Patel, who is an expert at math but is also secretly obsessed with his late father's dream of becoming a rap musician, and he almost loses everything in his attempt to achieve multiple goals in life.Tags : coming of age | disney...<more>",https://fzmovies.net/movie-Worlds%20Best--hmp4.htm,https://fzmovies.net/imdb_images/Worlds.Best.2023.jpg
Music,Hollywood,Victor Victoria,1982,BluRay,"A struggling female soprano finds work playing a male female impersonator, but it complicates her personal life.",https://fzmovies.net/movie-Victor%20Victoria--hmp4.htm,https://fzmovies.net/imdb_images/Victor.Victoria.1982.jpg
Music,Hollywood,To Write Love on Her Arms,2015,WEB-DL,"A drama centered around Renee Yohe and her battle with drugs, depression, and other life issues that ultimately leads to the founding of charity group To Write Love on Her Arms. ...<more>",https://fzmovies.net/movie-To%20Write%20Love%20on%20Her%20Arms--hmp4.htm,https://fzmovies.net/imdb_images/To.Write.Love.on.Her.Arms.2015.jpg
Music,Hollywood,Slumber Party Massacre 2,1987,BluRay,"Courtney, the younger sister of the ""new girl across the street"" in the first film is all grown up now, but suffers from nightmares about the Big Wet Incident. She and the other members of her female rock group go to a condo for the weekend to play music and have fun with their boyfriends.Tags : dream...<more>",https://fzmovies.net/movie-Slumber%20Party%20Massacre%202--hmp4.htm,https://fzmovies.net/imdb_images/Slumber.Party.Masacre.II.1987.jpg
Music,Hollywood,The King and I 1999,1999,WEB-DL,"Traveling to the exotic kingdom of Siam, English schoolteacher Anna Leonowens soon discovers that her most difficult challenge is the stubborn, imperious King himself.Tags : mother son relationship | father daughter relationship...<more>",https://fzmovies.net/movie-The%20King%20and%20I%201999--hmp4.htm,https://fzmovies.net/imdb_images/The.King.and.I.1999.jpg
Music,Hollywood,Being Frank The Chris Sievey Story,2019,BluRay,It's a documentary about the life of eccentric comidian Frank Sidebottom who wore a huge paper mache' head and whose true identity was a closely guarded secret until after died. The 2014 Magnolia Pictures film titled Frank was inspired by his sensational mystery. Written by Willow Dancer...<more>,https://fzmovies.net/movie-Being%20Frank%20The%20Chris%20Sievey%20Story--hmp4.htm,https://fzmovies.net/imdb_images/being.frank.the.chris.sievey.story.2018.jpg
Music,Hollywood,Concert for George,2003,BluRay,"George Harrison's friends, family, and bandmates unite for a tribute concert on the one-year anniversary of his death.",https://fzmovies.net/movie-Concert%20for%20George--hmp4.htm,https://fzmovies.net/imdb_images/Concert%20for%20George.jpg
Music,Hollywood,The Pirates of Penzance,1983,BluRay,"This movie is an adaptation of Gilbert and Sullivan's comic operetta of the same name, with parts of other of their operettas stirred in. Frederic has fallen in love with sweet innocent Mabel. Yet his vocation is an impediment to their union. Perhaps the situation can be rectified by his old nurse,…Tags : pirate | orphan...<more>",https://fzmovies.net/movie-The%20Pirates%20of%20Penzance--hmp4.htm,https://fzmovies.net/imdb_images/The.Pirates.of.Penzance.1983.jpg
Music,Hollywood,20 Feet from Stardom 2013,2013,BluRay,"Backup singers live in a world that lies just beyond the spotlight. Their voices bring harmony to the biggest bands in popular music, but we've had no idea who these singers are or what lives they lead, until now....<more>",https://fzmovies.net/movie-20%20Feet%20from%20Stardom%202013--hmp4.htm,https://fzmovies.net/imdb_images/20.Feet.From.Stardom.2013.jpg
Music,Hollywood,Monster Dog,1986,BluRay,A rock star returns to his childhood home to shoot a music video while a pack of wild dogs are on the loose killing off the local residents.,https://fzmovies.net/movie-Monster%20Dog--hmp4.htm,https://fzmovies.net/imdb_images/Monster.Dog.1984.jpg
Music,Hollywood,Bad 25,2012,BluRay,A documentary on Michael Jackson and the legacy of his record Bad.Tags : concert...<more>,https://fzmovies.net/movie-Bad%2025--hmp4.htm,https://fzmovies.net/imdb_images/Bad.25.2012.jpg
Music,Hollywood,Mrs Henderson Presents,2005,BluRay,"Recently widowed well-to-do Mrs. Laura Henderson (Dame Judi Dench) is at a bit of a loose end in inter-war London. On a whim, she buys the derelict Windmill theatre in the West End and persuades impresario Vivian Van Damm (Bob Hoskins) to run it, despite the fact the two don't seem to get along at…Tags : friend...<more>",https://fzmovies.net/movie-Mrs%20Henderson%20Presents--hmp4.htm,https://fzmovies.net/imdb_images/Mrs.Henderson.Presents.2005.jpg
Music,Hollywood,After The Screaming Stops,2018,BluRay,"In the 1980s, ""Bros"" were one of the biggest bands in the world - for 15 minutes. Having sold out stadiums around the world, they were the youngest to this day to play Wembley and their ""Push"" album went to Number 1 in over 20 countries, selling 10 million copies worldwide. The rise and fall of…...<more>",https://fzmovies.net/movie-After%20The%20Screaming%20Stops--hmp4.htm,https://fzmovies.net/imdb_images/after.the.screaming.stops.2018.jpg
Music,Hollywood,Rolling Stones: The Biggest Bang,2006,BRRip,,https://fzmovies.net/movie-Rolling%20Stones:%20The%20Biggest%20Bang--hmp4.htm,https://fzmovies.net/imdb_images/Rolling%20Stones:%20The%20Biggest%20Bang.jpg
Music,Hollywood,Blue Hawaii,1961,BluRay,"Chad Gates has just gotten out of the Army, and is happy to be back in Hawaii with his surf-board, his beach buddies, and his girlfriend. His father wants him to go to work at the Great Southern Hawaiian Fruit Company, but Chad is reluctant. So Chad goes to work as a tour guide at his girlfriend's…Tags : beach | hawaii...<more>",https://fzmovies.net/movie-Blue%20Hawaii--hmp4.htm,https://fzmovies.net/imdb_images/Blue.Hawaii.1961.jpg
Music,Hollywood,My Little Pony - Equestria Girls - Rainbow Rocks,2014,BluRay,"Three mysterious girls show up at canterlot high and cause trouble. With the magic of friendship, they want to defeat the mysterious girls.Tags : mind control...<more>",https://fzmovies.net/movie-My%20Little%20Pony%20-%20Equestria%20Girls%20-%20Rainbow%20Rocks--hmp4.htm,https://fzmovies.net/imdb_images/My.Little.Pony.Equestria.Girls.Rainbow.Rocks.2014.jpg
Music,Hollywood,The Year Without a Santa Claus,1974,BluRay,"Mrs. Claus tells us about the time Santa had a bad cold and decided to take a vacation from Christmas. Two of his elves, Jingle Bells and Jangle Bells decided to go out (with Vixen) to find children to convince Santa that the Christmas spirit is still important to everybody else. But they have to…Tags : christmas | snow | vacation...<more>",https://fzmovies.net/movie-The%20Year%20Without%20a%20Santa%20Claus--hmp4.htm,https://fzmovies.net/imdb_images/The.Year.Without.A.Santa.Claus.1974.jpg
Music,Hollywood,Billy Elliot the Musical Live 2014,2014,WEB-DL,A talented young dancer has to learn to fight for his dream despite social and parental disapproval.,https://fzmovies.net/movie-Billy%20Elliot%20the%20Musical%20Live%202014--hmp4.htm,https://fzmovies.net/imdb_images/Billy.Elliot.the.Musical.Live.2014.jpg
Music,Hollywood,Libertys Secret 2016,2016,HDRip,"The squeaky-clean daughter of a ""family values"" preacher becomes a national political sensation and falls in love with her spin doctor -- another woman. ...<more>",https://fzmovies.net/movie-Libertys%20Secret%202016--hmp4.htm,https://fzmovies.net/imdb_images/Libertys.Secret.2016.jpg
Music,Hollywood,Slayer The Repentless Killogy,2019,BluRay,"'Slayer: The Repentless Killogy' is a short narrative film written and directed by BJ McDonnell, that blends the music of Slayer with an uncompromising and unmissable, trilogy of music videos assembled as one chronological story-line. ...<more>",https://fzmovies.net/movie-Slayer%20The%20Repentless%20Killogy--hmp4.htm,https://fzmovies.net/imdb_images/Slayer.The.Repentless.Killogy.2019.jpg
Music,Hollywood,Charli XCX Alone Together,2022,WEB-DL,Global pop star Charli XCX enlists fans to help her produce the album how i'm feeling now while quarantined during the COVID-19 pandemic.,https://fzmovies.net/movie-Charli%20XCX%20Alone%20Together--hmp4.htm,https://fzmovies.net/imdb_images/Charli.XCX.Alone.Together.2021.jpg
Music,Hollywood,24 Hour Party People,2002,BluRay,"Manchester 1976: Cambridge educated Tony Wilson, Granada TV presenter, is at a Sex Pistols gig. Totally inspired by this pivotal moment in music history, he and his friends set up a record label, Factory Records, signing first Joy Division (who go on to become New Order) then James and the Happy…Tags : england...<more>",https://fzmovies.net/movie-24%20Hour%20Party%20People--hmp4.htm,https://fzmovies.net/imdb_images/24.Hour.Party.People.2002.jpg
