genre,category,title,year,distribution,description,url,cover_photo
Music,Hollywood,Parade of the Dead,2010,BluRay,In 2010 a virus spread throughout the world's population turning the survivors Into mindless zombies. Around the same time of these Apocalyptic events the Hilltop Hoods were due to make a dvd for their Album 'State of the Art'. As......<more>,https://fzmovies.net/movie-Parade%20of%20the%20Dead--hmp4.htm,https://fzmovies.net/imdb_images/Parade.of.the.Dead.2010.jpg
Music,Hollywood,Marian Anderson The Whole World in Her Hands,2022,WEBRip,"Documentary on Marian Anderson an African American woman, an international singing star in the twentieth century, who succeeded over racial prejudice and became an inspiration for America's civil rights movement....<more>",https://fzmovies.net/movie-Marian%20Anderson%20The%20Whole%20World%20in%20Her%20Hands--hmp4.htm,https://fzmovies.net/imdb_images/Marian.Anderson.The.Whole.World.in.Her.Hands.2022.jpg
Music,Hollywood,Abortifacient,2020,WEB-DL,"A genre-bending 'operatic cinema' featuring 18 classical music pieces, this psychological horror feature tells the story of a young couple that has issues when confronted with an unexpected pregnancy. A film that explores love, ro......<more>",https://fzmovies.net/movie-Abortifacient--hmp4.htm,https://fzmovies.net/imdb_images/Abortifacient.2020.jpg
Music,Hollywood,Islanders,2022,WEB-DL,Documentary filmmakers follow electro-pop duo FINKEL as they set out to write a record from within the frozen forests of their hometown - Michigan's isolated and eccentric Mackinac Island....<more>,https://fzmovies.net/movie-Islanders--hmp4.htm,https://fzmovies.net/imdb_images/Islanders.2022.jpg
Music,Hollywood,Gutboy A Badtime Story,2017,WEB-DL,"A flayed man teams up with a vengeful mermaid to prank the corrupt forces of law, order and the free market... to death.Tags : prank...<more>",https://fzmovies.net/movie-Gutboy%20A%20Badtime%20Story--hmp4.htm,https://fzmovies.net/imdb_images/Gutboy.A.Badtime.Story.2017.jpg
Music,Hollywood,Stranger in My Own Skin,2023,WEBRip,Plot under wraps.,https://fzmovies.net/movie-Stranger%20in%20My%20Own%20Skin--hmp4.htm,https://fzmovies.net/imdb_images/Stranger.in.My.Own.Skin.2023.jpg
Music,Hollywood,Hans Zimmer Live in Prague,2017,BluRay,The renowned film score composer leads a concert featuring his cinematic compositions.Tags : tv special...<more>,https://fzmovies.net/movie-Hans%20Zimmer%20Live%20in%20Prague--hmp4.htm,https://fzmovies.net/imdb_images/Hans.Zimmer.Live.in.Prague.2017.jpg
Music,Hollywood,A Remarkable Life,2016,WEBRip,Chelsea helps Leny overcome his life from a down-spin as his reality comes crashing down after he discovers his wife in bed with another woman.,https://fzmovies.net/movie-A%20Remarkable%20Life--hmp4.htm,https://fzmovies.net/imdb_images/A.Remarkable.Life.2016.jpg
Music,Hollywood,Stevie Wonder Live at Last,2009,BluRay,,https://fzmovies.net/movie-Stevie%20Wonder%20Live%20at%20Last--hmp4.htm,https://fzmovies.net/imdb_images/Stevie.Wonder.Live.at.Last.2009.jpg
Music,Hollywood,When Youre Strange,2010,BluRay,"A look at the late '60s and early '70s rock band The Doors, including rare exclusive footage.Tags : police officer...<more>",https://fzmovies.net/movie-When%20Youre%20Strange--hmp4.htm,https://fzmovies.net/imdb_images/When.Youre.Strange.2009.jpg
Music,Hollywood,Christmas Tree Lane,2020,WEB-DL,Meg wants to save her neighborhood from getting demolished. She then discovers that Nate has other plans. Can she turn Nate's heart toward Christmas?Tags : christmas | small town | piano...<more>,https://fzmovies.net/movie-Christmas%20Tree%20Lane--hmp4.htm,https://fzmovies.net/imdb_images/Christmas.Tree.Lane.2020.jpg
Music,Hollywood,Tear the Roof Off The Untold Story of Parliament Funkadelic,2016,WEB-DL,"The untold true story: The rise and fall of the greatest funk band ever, Parliament Funkadelic.",https://fzmovies.net/movie-Tear%20the%20Roof%20Off%20The%20Untold%20Story%20of%20Parliament%20Funkadelic--hmp4.htm,https://fzmovies.net/imdb_images/Tear.the.Roof.Off.The.Untold.Story.of.Parliament.Funkadelic.2016.jpg
Music,Hollywood,Duran Duran A Hollywood High,2022,WEBRip,"Duran Duran's live show becomes immortalized on the big screen. Featuring exclusive new interviews, behind-the-scenes video and unseen archival footage, the film celebrates the band's four-decade-long career....<more>",https://fzmovies.net/movie-Duran%20Duran%20A%20Hollywood%20High--hmp4.htm,https://fzmovies.net/imdb_images/Duran.Duran.A.Hollywood.High.2022.jpg
Music,Hollywood,Alleluia The Devils Carnival,2016,BluRay,Lucifer and his carnies are plotting against Heaven. This is how the war begins.Tags : redemption | carnival | devil...<more>,https://fzmovies.net/movie-Alleluia%20The%20Devils%20Carnival--hmp4.htm,https://fzmovies.net/imdb_images/Alleluia.The.Devils.Carnival.2016.jpg
Music,Hollywood,Rockin with Judy Jetson,1988,BluRay,"There's intergalactic trouble when the lyrics Judy Jetson wrote for teen heartthrob Sky Rocker are swapped with a secret message from a music-hating witch. Now it's up to Judy, her family, and friends to save rock-and-roll.Tags : outer space...<more>",https://fzmovies.net/movie-Rockin%20with%20Judy%20Jetson--hmp4.htm,https://fzmovies.net/imdb_images/Rockin.with.Judy.Jetson.1988.jpg
Music,Hollywood,Follow That Bird,1985,WEB-DL,"Big Bird is sent to live far from Sesame Street by a pesky social worker named Miss Finch. Unhappy, he runs away from there, prompting the rest of the Sesame Street gang to go on a cross-country journey to find him.Tags : journey | song | on the run...<more>",https://fzmovies.net/movie-Follow%20That%20Bird--hmp4.htm,https://fzmovies.net/imdb_images/Follow.That.Bird.1985.jpg
Music,Hollywood,Ladies and Gentlemen the Fabulous Stains,1982,BluRay,"The media and disaffected teens mistake the acerbic rants of an obnoxious teenage punk rocker as a rallying cry for the women of America, launching her and her talentless group to national stardom.Tags : interview | betrayal | concert...<more>",https://fzmovies.net/movie-Ladies%20and%20Gentlemen%20the%20Fabulous%20Stains--hmp4.htm,https://fzmovies.net/imdb_images/Ladies.and.Gentlemen.the.Fabulous.Stains.1982.jpg
Music,Hollywood,The Velvet Underground,2021,BluRay,The Velvet Underground explores the multiple threads that converged to bring together one of the most influential bands in rock and roll.,https://fzmovies.net/movie-The%20Velvet%20Underground--hmp4.htm,https://fzmovies.net/imdb_images/The.Velvet.Underground.2021.jpg
Music,Hollywood,Willie Nelson American Outlaw,2020,WEBRip,"Willie Nelson - American Outlaw captures the most iconic moments from a one-night-only concert event honoring Willie Nelson and his music. This two-hour program is packed with over 20 original performances, never before seen inter...Tags : tv special...<more>",https://fzmovies.net/movie-Willie%20Nelson%20American%20Outlaw--hmp4.htm,https://fzmovies.net/imdb_images/Willie.Nelson.American.Outlaw.2020.jpg
Music,Hollywood,Toby Keith American Icon,2024,WEB-DL,Tags : tv special...<more>,https://fzmovies.net/movie-Toby%20Keith%20American%20Icon--hmp4.htm,https://fzmovies.net/imdb_images/Toby.Keith.American.Icon.2024.jpg
Music,Hollywood,Jimi Hendrix Voodoo Child,2010,BluRay,Jimi Hendrix talking about how he became who he is.,https://fzmovies.net/movie-Jimi%20Hendrix%20Voodoo%20Child--hmp4.htm,https://fzmovies.net/imdb_images/Jimi.Hendrix.Voodoo.Child.2010.jpg
Music,Hollywood,Money from Home,1953,BluRay,"When Herman promises the mob to fix a racing horse in order to pay off his debts, he selects his veterinarian cousin as a patsy to help him but things go awry.Tags : 3 dimensional | gangster...<more>",https://fzmovies.net/movie-Money%20from%20Home--hmp4.htm,https://fzmovies.net/imdb_images/Money.from.Home.1953.jpg
Music,Hollywood,Not the Messiah Hes a Very Naughty Boy,2010,BluRay,A comic oratorio inspired by Life of Brian (1979) filmed at its only European performance at the Royal Albert Hall in October 2009 to celebrate forty years of Monty Python.Tags : claim in title | punctuation in title...<more>,https://fzmovies.net/movie-Not%20the%20Messiah%20Hes%20a%20Very%20Naughty%20Boy--hmp4.htm,https://fzmovies.net/imdb_images/Not.the.Messiah.Hes.a.Very.Naughty.Boy.2010.jpg
Music,Hollywood,Blue Valley Songbird,1999,WEBRip,"A popular Nashville performer wants national recognition but is hampered by her controlling boyfriend and manager, and events from her past. Finally, by turning to her guitarist, she finds the resolve to face her troubles, includi...Tags : rural setting | adultery...<more>",https://fzmovies.net/movie-Blue%20Valley%20Songbird--hmp4.htm,https://fzmovies.net/imdb_images/Blue.Valley.Songbird.1999.jpg
Music,Hollywood,ZZ Top That Little Ol Band from Texas,2019,BluRay,"The story of how three oddball teenage bluesmen became one of the biggest, most beloved bands on the planet.Tags : musician | texas...<more>",https://fzmovies.net/movie-ZZ%20Top%20That%20Little%20Ol%20Band%20from%20Texas--hmp4.htm,https://fzmovies.net/imdb_images/ZZ.Top.That.Little.Ol.Band.from.Texas.2019.jpg
Music,Hollywood,Pixel Perfect,2004,BluRay,A teen uses a holograph to create a pop star for his friend's band.Tags : band...<more>,https://fzmovies.net/movie-Pixel%20Perfect--hmp4.htm,https://fzmovies.net/imdb_images/Pixel.Perfect.2004.jpg
Music,Hollywood,I Used to Be Darker,2013,WEBRip,"A runaway seeks refuge with her aunt and uncle in Baltimore and finds their marriage ending and her cousin in crisis. In the days that follow, the family struggles to let go of the past while searching for new things to hold onto.Tags : family relationships | claim in title...<more>",https://fzmovies.net/movie-I%20Used%20to%20Be%20Darker--hmp4.htm,https://fzmovies.net/imdb_images/I.Used.to.Be.Darker.2013.jpg
Music,Hollywood,BearCity 2 The Proposal,2012,WEBRip,"Kathy Najimy plays den mother to the returning cast of bears, boys and cubs, for a Bear Week bachelor party in Provincetown! Take a trip down the aisle with Roger and Tyler to one of the most magical beach towns on earth in this r...Tags : bachelor party | five word title...<more>",https://fzmovies.net/movie-BearCity%202%20The%20Proposal--hmp4.htm,https://fzmovies.net/imdb_images/BearCity.2.The.Proposal.2012.jpg
Music,Hollywood,Dangerous When Wet,1953,BluRay,"With her promoter-trainer and family in tow, Katie Higgins swims her way from the Arkansas Ozarks to foggy London and the English Channel. - SimonJack",https://fzmovies.net/movie-Dangerous%20When%20Wet--hmp4.htm,https://fzmovies.net/imdb_images/Dangerous.When.Wet.1953.jpg
Music,Hollywood,Odesza The Last Goodbye Cinematic Experience,2023,BluRay,A documentary about the friends who made a name for themselves with electronic music live concerts.,https://fzmovies.net/movie-Odesza%20The%20Last%20Goodbye%20Cinematic%20Experience--hmp4.htm,https://fzmovies.net/imdb_images/Odesza.The.Last.Goodbye.Cinematic.Experience.2023.jpg
Music,Hollywood,Madam Satan,1930,WEBRip,"Angela and Bob Brooks are an upper-class couple. Unfortunately, Bob is an unfaithful husband, but Angela has a plan to win back her husband's affections. An elaborate masquerade ball is to be held aboard a magnificent dirigible. A...Tags : character name as title...<more>",https://fzmovies.net/movie-Madam%20Satan--hmp4.htm,https://fzmovies.net/imdb_images/Madam.Satan.1930.jpg
Music,Hollywood,Harmonious Live,2022,WEBRip,Feel the transcendent power of classic Disney music reinterpreted by artists from around the world as we celebrate World Music Day together.Tags : tv special...<more>,https://fzmovies.net/movie-Harmonious%20Live--hmp4.htm,https://fzmovies.net/imdb_images/Harmonious.Live.2022.jpg
Music,Hollywood,Live a Little Love a Little,1968,WEB-DL,"Photographer Greg Nolan moonlights in two full-time jobs to pay the rent, but has trouble finding time to do them both without his bosses finding out.",https://fzmovies.net/movie-Live%20a%20Little%20Love%20a%20Little--hmp4.htm,https://fzmovies.net/imdb_images/Live.a.Little.Love.a.Little.1968.jpg
Music,Hollywood,Handels Last Chance,1996,DVDRip,A Dublin street kid is selected as a choirboy for Handel's first performance of The Messiah. His friendship helps deliver the composer from a temporary lack of self esteem and restores his great glory.Tags : independent film...<more>,https://fzmovies.net/movie-Handels%20Last%20Chance--hmp4.htm,https://fzmovies.net/imdb_images/Handels.Last.Chance.1996.jpg
Music,Hollywood,Blake and Gwen Now and Then,2021,WEBRip,"Follow the offstage, unlikely romance of the king of country, Blake Shelton, and pop princess, Gwen Stefani. Both stars braved their share of challenges on the way to writing their own love song.Tags : love...<more>",https://fzmovies.net/movie-Blake%20and%20Gwen%20Now%20and%20Then--hmp4.htm,https://fzmovies.net/imdb_images/Blake.and.Gwen.Now.and.Then.2021.jpg
Music,Hollywood,This World Wont Break,2019,WEBRip,"A broke-down middle aged Texas troubadour yearns to be remembered like the southern bluesmen before him, but his failings and self-doubt forestall his musical dreams and blind him to the open road.
...<more>",https://fzmovies.net/movie-This%20World%20Wont%20Break--hmp4.htm,https://fzmovies.net/imdb_images/This.World.Wont.Break.2020.jpg
Music,Hollywood,Frosty Returns,1992,BluRay,The continuing exploits of the famous snowman as he goes up against a more powerful force which threatens all of Christmas.Tags : snow...<more>,https://fzmovies.net/movie-Frosty%20Returns--hmp4.htm,https://fzmovies.net/imdb_images/Frosty.Returns.1992.jpg
Music,Hollywood,One December Night,2021,WEB-DL,Two music managers must put their history aside to oversee the televised reunion performances of their rock-star fathers with a fractured past.Tags : christmas...<more>,https://fzmovies.net/movie-One%20December%20Night--hmp4.htm,https://fzmovies.net/imdb_images/One.December.Night.2021.jpg
Music,Hollywood,Billy Connolly Big Banana Feet,1977,BluRay,Follows comedian Billy Connolly on his 1975 tour of Ireland.Tags : tv special | stand up comedy...<more>,https://fzmovies.net/movie-Billy%20Connolly%20Big%20Banana%20Feet--hmp4.htm,https://fzmovies.net/imdb_images/Billy.Connolly.Big.Banana.Feet.1977.jpg
Music,Hollywood,April Love,1957,DVDRip,"Chicagoan Nick Conover received a suspended sentence for being caught joyriding in a stolen car, with his driver's license suspended indefinitely. Nicky's problems are seen as running around with the wrong crowd. Nicky's sentence is predicated on him living at the run down Kentucky horse farm of…Tags : farm...<more>",https://fzmovies.net/movie-April%20Love--hmp4.htm,https://fzmovies.net/imdb_images/April.Love.1957.jpg
Music,Hollywood,Shake the Dust,2015,WEBRip,"""Shake the Dust"" is a feature documentary that tells the stories of break dancers from conflicted ""third- world"" communities around the globe who, although separated by cultural boundaries and individual struggles, are intrinsical......<more>",https://fzmovies.net/movie-Shake%20the%20Dust--hmp4.htm,https://fzmovies.net/imdb_images/Shake.the.Dust.2014.jpg
Music,Hollywood,Genesis When in Rome,2008,WEBRip,"It had been 15 years since Banks, Collins and Rutherford last took to the stage and this is their final tour to date.",https://fzmovies.net/movie-Genesis%20When%20in%20Rome--hmp4.htm,https://fzmovies.net/imdb_images/Genesis.When.in.Rome.2008.jpg
Music,Hollywood,Fiddling Around,1930,WEB-DL,"Mickey comes onstage to the applause of an unseen audience and plays various classical tunes on the violin, after some minor mishaps. During a sad song, he is overcome with emotion and has to stop....<more>",https://fzmovies.net/movie-Fiddling%20Around--hmp4.htm,https://fzmovies.net/imdb_images/Fiddling.Around.1930.jpg
Music,Hollywood,When Nirvana Came to Britain,2021,WEBRip,"A look at the special relationship between Nirvana and the UK on the 30th anniversary of their seminal album Nevermind, including the role Britain played in paving the way for their success....<more>",https://fzmovies.net/movie-When%20Nirvana%20Came%20to%20Britain--hmp4.htm,https://fzmovies.net/imdb_images/When.Nirvana.Came.to.Britain.2021.jpg
Music,Hollywood,Taking 5,2007,WEBRip,"Two geeky teens kidnap the world's most famous boy-band in an attempt to make them play at their high school, which would boost the girls' popularity.Tags : high school...<more>",https://fzmovies.net/movie-Taking%205--hmp4.htm,https://fzmovies.net/imdb_images/Taking.5.2007.jpg
Music,Hollywood,When Tomorrow Comes,1939,BluRay,A concert pianist unhappily married to a mentally-ill woman falls in love with a waitress.Tags : dysfunctional marriage...<more>,https://fzmovies.net/movie-When%20Tomorrow%20Comes--hmp4.htm,https://fzmovies.net/imdb_images/When.Tomorrow.Comes.1939.jpg
Music,Hollywood,Lulu on the Bridge,1998,BluRay,A famous jazz saxophonist's life is forever changed after he is accidentally shot.Tags : watching tv...<more>,https://fzmovies.net/movie-Lulu%20on%20the%20Bridge--hmp4.htm,https://fzmovies.net/imdb_images/Lulu.on.the.Bridge.1998.jpg
Music,Hollywood,Jumping Jacks,1952,WEBRip,Nightclub comic Hap Smith assumes the identity of another soldier so he can tour army bases in a revue with his ex-partner Chuck Allen.Tags : military | nightclub...<more>,https://fzmovies.net/movie-Jumping%20Jacks--hmp4.htm,https://fzmovies.net/imdb_images/Jumping.Jacks.1952.jpg
Music,Hollywood,Qlimax The Source,2020,WEB-DL,Embark on a journey into sound through the mystical world of Qlimax. An immersive audiovisual hardstyle trip that lets you follow the ways of The Source. Do you have what it takes to fulfill your destiny?Tags : journey...<more>,https://fzmovies.net/movie-Qlimax%20The%20Source--hmp4.htm,https://fzmovies.net/imdb_images/Qlimax.The.Source.2020.jpg
Music,Hollywood,Rhythm Masters A Mickey Hart Experience,2024,WEBRip,"Exploring rhythmic connections between music and sports through an original score inspired by athletes, revealing universal rhythm in music, sports, and life...<more>",https://fzmovies.net/movie-Rhythm%20Masters%20A%20Mickey%20Hart%20Experience--hmp4.htm,https://fzmovies.net/imdb_images/Rhythm.Masters.A.Mickey.Hart.Experience.2024.jpg
Music,Hollywood,Cassette A Documentary Mixtape,2016,BluRay,"Cassette inventor Lou Ottens digs through his past to figure out why the audiotape won't die. Rock veterans like Henry Rollins, Thurston Moore, and Ian MacKaye join a legion of young bands releasing music on tape to push Lou along......<more>",https://fzmovies.net/movie-Cassette%20A%20Documentary%20Mixtape--hmp4.htm,https://fzmovies.net/imdb_images/Cassette.A.Documentary.Mixtape.2016.jpg
Music,Hollywood,Lennons Last Weekend,2020,WEB-DL,"In December 1980, John Lennon and Yoko Ono had not spoken to the media for more than five years. With a new album to promote Lennon was prepared to speak in New York to Radio One D.J. Andy Peebles of the BBC. John surprised everyone ...<more>",https://fzmovies.net/movie-Lennons%20Last%20Weekend--hmp4.htm,https://fzmovies.net/imdb_images/Lennons.Last.Weekend.2020.jpg
Music,Hollywood,Evanescence Embracing the Bitter Truth,2021,WEB-DL,"Multi-platinum rockers Evanescence chart their journey through the conception and creation of their new album, The Bitter Truth, amidst the worldwide COVID-19 pandemic....<more>",https://fzmovies.net/movie-Evanescence%20Embracing%20the%20Bitter%20Truth--hmp4.htm,https://fzmovies.net/imdb_images/Evanescence.Embracing.the.Bitter.Truth.2021.jpg
Music,Hollywood,Anything Goes,2021,BluRay,"Filmed live at the Barbican in London, this major new 5-star production of the classic musical comedy features an all-star cast. When the S.S. American heads out to sea, etiquette and convention head out the portholes as two unlik......<more>",https://fzmovies.net/movie-Anything%20Goes--hmp4.htm,https://fzmovies.net/imdb_images/Anything.Goes.2021.jpg
Music,Hollywood,The Stingiest Man in Town,1978,BluRay,"This version of the story is told from the perspective of B.A.H. Humbug. After Ebenezer Scrooge refuses to assist the poor or have Christmas Dinner with his nephew, he is visited by the ghost of his one time business partner and f...Tags : ghost...<more>",https://fzmovies.net/movie-The%20Stingiest%20Man%20in%20Town--hmp4.htm,https://fzmovies.net/imdb_images/The.Stingiest.Man.in.Town.1978.jpg
Music,Hollywood,Joseph and the Amazing Technicolor Dreamcoat,2000,BluRay,A humorously musical retelling of the Biblical story of Joseph.Tags : slavery | brother brother relationship...<more>,https://fzmovies.net/movie-Joseph%20and%20the%20Amazing%20Technicolor%20Dreamcoat--hmp4.htm,https://fzmovies.net/imdb_images/Joseph.and.the.Amazing.Technicolor.Dreamcoat.1999.jpg
Music,Hollywood,Down Dakota Way,1949,WEB-DL,A crooked businessman is trying to sell cattle infected with deadly hoof-and-mouth disease. He has the local veterinarian murdered to cover up his plans....<more>,https://fzmovies.net/movie-Down%20Dakota%20Way--hmp4.htm,https://fzmovies.net/imdb_images/Down.Dakota.Way.1949.jpg
Music,Hollywood,Catching Air,2023,WEBRip,"Unleashing the power of invisible chords, a group of passionate competitors from around the world take to the stage to prove that air guitar is more than just a performance--it's a way of life....<more>",https://fzmovies.net/movie-Catching%20Air--hmp4.htm,https://fzmovies.net/imdb_images/Catching.Air.2023.jpg
Music,Hollywood,Ailey,2021,BluRay,"An immersive portrait of dance pioneer Alvin Ailey, told through his own words and a new dance inspired by his life.Tags : gay | one word title | character name as title...<more>",https://fzmovies.net/movie-Ailey--hmp4.htm,https://fzmovies.net/imdb_images/Ailey.2021.jpg
Music,Hollywood,Nothing But the Truth,1941,BluRay,"A stockbroker's new partner bets $10,000 that he can only tell the truth for twenty-four hours.",https://fzmovies.net/movie-Nothing%20But%20the%20Truth--hmp4.htm,https://fzmovies.net/imdb_images/Nothing.But.the.Truth.1941.jpg
Music,Hollywood,Sita Sings the Blues,2009,BluRay,An animated version of the epic Indian tale of Ramayana set to the 1920s jazz vocals of Annette Hanshaw.Tags : title directed by female...<more>,https://fzmovies.net/movie-Sita%20Sings%20the%20Blues--hmp4.htm,https://fzmovies.net/imdb_images/Sita.Sings.the.Blues.2008.jpg
Music,Hollywood,A Slipping Down Life,1999,WEBRip,"A shy, young woman, living a sheltered life in a small southern town, embarks on a journey to self-awareness when she falls in love with an eccentric rock star.Tags : love | singer | north carolina...<more>",https://fzmovies.net/movie-A%20Slipping%20Down%20Life--hmp4.htm,https://fzmovies.net/imdb_images/A.Slipping.Down.Life.1999.jpg
Music,Hollywood,Week End at the Waldorf,1945,DVDRip,The misadventures of a group of diverse guests at the Waldorf Astoria hotel in Manhattan.Tags : new york city...<more>,https://fzmovies.net/movie-Week%20End%20at%20the%20Waldorf--hmp4.htm,https://fzmovies.net/imdb_images/Week.End.at.the.Waldorf.1945.jpg
Music,Hollywood,Shella Record  A Reggae Mystery,2019,WEBRip,"A vinyl fanatic becomes haunted by a lost singer's voice after discovering an incredible junk shop record. He embarks on a surreal adventure with the help of psychics, private investigators and a ghost hunter.Tags : independent film...<more>",https://fzmovies.net/movie-Shella%20Record%20%20A%20Reggae%20Mystery--hmp4.htm,https://fzmovies.net/imdb_images/Shella.Record.A.Reggae.Mystery.2019.jpg
Music,Hollywood,The Little Drummer Boy Book II,1976,BluRay,"Aaron, the drummer boy, struggles to protect a bellmaker's great silver bells from seizure by Roman soldiers.Tags : boy | six word title...<more>",https://fzmovies.net/movie-The%20Little%20Drummer%20Boy%20Book%20II--hmp4.htm,https://fzmovies.net/imdb_images/The.Little.Drummer.Boy.Book.II.1976.jpg
Music,Hollywood,Genesis Together and Apart,2014,BluRay,"Phil Collins, Peter Gabriel, Steve Hackett, Mike Rutherford and Tony Banks reunite to do a documentary spanning most of the career of Genesis and their solo careers....<more>",https://fzmovies.net/movie-Genesis%20Together%20and%20Apart--hmp4.htm,https://fzmovies.net/imdb_images/Genesis.Together.and.Apart.2014.jpg
Music,Hollywood,Nutcracker 1986,1986,WEB-DL,"The colorful holiday classic is brought to the big screen, designed by famed children's story author and artist Maurice Sendak, and written to be as close to the original story. Based on the Pacific Northwest Ballet's original pro...Tags : dancing | dream | voice over narration...<more>",https://fzmovies.net/movie-Nutcracker%201986--hmp4.htm,https://fzmovies.net/imdb_images/Nutcracker.1986.jpg
Music,Hollywood,In His Life The John Lennon Story,2000,WEBRip,A film about the early life of the rock musician and his burgeoning career as a member of the Beatles.Tags : musician...<more>,https://fzmovies.net/movie-In%20His%20Life%20The%20John%20Lennon%20Story--hmp4.htm,https://fzmovies.net/imdb_images/In.His.Life.The.John.Lennon.Story.2000.jpg
Music,Hollywood,Catalina Caper,1967,DVDRip,"A beach movie. A scroll is stolen from an art gallery and taken to Catalina Island, where the thieves plan to use it to swindle Lakopolous, a Greek art collector. They plan to show him the real scroll, then deliver a fake. Lakopolous, however, turns out not to be rock-stupid, and tries to steal the…Tags : beach | bikini...<more>",https://fzmovies.net/movie-Catalina%20Caper--hmp4.htm,https://fzmovies.net/imdb_images/Catalina.Caper.1967%20.jpg
Music,Hollywood,The Decline of Western Civilization Part II The Metal Years,1989,BluRay,"Documentary showcase, what life was like for the music artists living during the Los Angeles Heavy Metal scene in the mid and late 1980s.Tags : f rated...<more>",https://fzmovies.net/movie-The%20Decline%20of%20Western%20Civilization%20Part%20II%20The%20Metal%20Years--hmp4.htm,https://fzmovies.net/imdb_images/The.Decline.of.Western.Civilization.Part.II.The.Metal.Years.1988.jpg
