genre,category,title,year,distribution,description,url,cover_photo
Musical,Bollywood,Vivah,2006,BluRay,"After the passing away of his wife, wealthy Delhi-based businessman, Harishchandra, took it upon himself to bring up two sons, Sunil and Prem. When they grew up he got Sunil married to Bhavna, and let Prem complete his education, even let him study abroad. Soon Sunil and Bhavna gave birth to a son, Rahul. When Bhagat told him that he had found a suitable match for Prem in Poonam, the niece of Krishnakant, a fruit merchant from Madhupur, Uttar Pradesh, the family traveled there, met with Krishnakant, his wife, Rama, and daughter, Rajni, and instantly approved of Poonam. Prem and Poonam also approved of each other, the Astrologer was consulted and a marriage was scheduled to take place in six months time. Shortly thereafter the engagement took place. The two families met again in Som Sarovar, Nainital, to let everyone get acquainted, and when Prem got his first contract from Japan, Krishnakant took his family to Delhi to celebrate. With the deadline for the marriage drawing close, both families start their respective preparations - not knowing that fate may have other plans in store for this young couple. ...<more>",https://fzmovies.net/movie-Vivah--hmp4.htm,https://fzmovies.net/imdb_images/Vivah.jpg
Musical,Bollywood,Lagaan,2001,BluRay,The people of a small village in Victorian India stake their future on a game of cricket against their ruthless British rulers...,https://fzmovies.net/movie-Lagaan--hmp4.htm,https://fzmovies.net/imdb_images/Lagaan.jpg
Musical,Bollywood,Om Shanti Om,2007,BluRay,"In the 1970s, Om, an aspiring actor, is murdered, but is immediately reincarnated into the present day. He attempts to discover the mystery of his demise and find Shanti, the love of his previous life....<more>",https://fzmovies.net/movie-Om%20Shanti%20Om--hmp4.htm,https://fzmovies.net/imdb_images/Om%20Shanti%20Om.jpg
Musical,Bollywood,Agneepath,2012,BluRay,A young boy's father is lynched before his eyes; fifteen years later he returns home for revenge.,https://fzmovies.net/movie-Agneepath--hmp4.htm,https://fzmovies.net/imdb_images/Agneepath.jpg
Musical,Bollywood,Hum Saath Saath Hain,1999,WEB-DL,"The trials and challenges of a joint family in India, whose parents are Ramkishen and second wife Mamta, and have three sons and a married daughter. The eldest son is handicapped since birth, and is from Ramkishen's first wife. Mamta, the second wife, hates him, and like Kaikeyi in Ramayana wants the estate and wealth in her sons' names. She and her daughter's father-in-law, scheme together, and have the eldest son, including his wife and child, thrown out of the house. Mamta and her sons are all set to control the finances and the estate - until she finds out that her very own sons do not approve of nor support her actions in throwing their step-brother out of the house. ...<more>",https://fzmovies.net/movie-Hum%20Saath%20Saath%20Hain--hmp4.htm,https://fzmovies.net/imdb_images/Hum%20Saath%20Saath%20Hain.jpg
Musical,Bollywood,Munna Michael,2017,WEBRip,"A young man, tries to follow the footsteps of his idol, The King of Pop, Michael Jackson.",https://fzmovies.net/movie-Munna%20Michael--hmp4.htm,https://fzmovies.net/imdb_images/Munna.Michael.2017.jpg
Musical,Bollywood,Hum Aapke Hain Koun,1994,BluRay,"It tells the story of two lovers, Prem (Salman Khan) and Nisha (Madhuri Dixit). Their older siblings, Rajesh and Pooja get married. After Pooja has her baby, the elders decide to get Prem married with a girl like Pooja. Prem and Nisha slowly fall in love with each other. Prem tells his sister-in-law, Nisha's older sister, Pooja, that he loves Nisha.Pooja binds the two with her blessings and a necklace. Before Pooja can tell anyone the good news, she falls down the stairs, and dies. Everyone feels they lost their life after Pooja dies, because she had a magic touch that even the dog, Tuffy, notices. Rajesh finds life hard without Pooja, and he finds it especially hard to raise their son. The parents decide to get Rajesh married to Nisha so that he won't feel so lonely, and his son will get a mother. Nisha unknowingly accepts because she thinks that she is going to marry Prem. When she finds out she is marrying Rajesh, the two lovers decide to sacrifice their love for Rejesh's happiness. The servant that Pooja treated like a brother prays to God to stop the wedding and have Prem and Nisha get married. The dog decides to do something and takes the necklace Pooja gave to Nisha to wear to her wedding with Prem. Nisha writes a note saying that she is giving Pooja's bind back to Prem. The dog takes the necklace and note and instead of giving it to Prem, he gives to Rajesh. Rajesh finds out that Nisha and Prem love each other, and steps aside so that his younger brother can marry Nisha. They live happily ever after. ...<more>",https://fzmovies.net/movie-Hum%20Aapke%20Hain%20Koun--hmp4.htm,https://fzmovies.net/imdb_images/Hum%20Aapke%20Hain%20Koun.jpg
Musical,Bollywood,Jodhaa Akbar,2008,BluRay,"A sixteenth century love story about a marriage of alliance that gave birth to true love between a great Mughal emperor, Akbar, and a Rajput princess, Jodha....<more>",https://fzmovies.net/movie-Jodhaa%20Akbar--hmp4.htm,https://fzmovies.net/imdb_images/Jodhaa%20Akbar.jpg
Musical,Bollywood,Andaaz,2003,BluRay,"Loyalty, Respect, commitment and love. What is Love? Loyalty, respect, commitment and friendship. Friendship and Love... Love and Friendship... So much in common, yet so different in emotion!
...<more>",https://fzmovies.net/movie-Andaaz--hmp4.htm,https://fzmovies.net/imdb_images/Andaaz.jpg
Musical,Bollywood,Ek Paheli Leela,2015,HDRip,"Ek Paheli Leela is a reincarnation story about the love between Leela and her lover, which is left incomplete as one of them is murdered. The story comes to an end after 300 long years, when Leela has become Meera and her lover's character is also reborn.
...<more>",https://fzmovies.net/movie-Ek%20Paheli%20Leela--hmp4.htm,https://fzmovies.net/imdb_images/Ek.paheli.leela.2015.jpg
Musical,Bollywood,Hum Dil De Chuke Sanam,1998,BluRay,"When Salman asks for Ash's hand in marriage her family refuses. They have already chosen a husband for their daughter. Salman returns to Italy. When Ajay, Ash's new husband realizes that his new bride has been in love with someone else, he is prepared to sacrifice his love for her and take her to Italy to be reunited with her true love, Salman. ...<more>",https://fzmovies.net/movie-Hum%20Dil%20De%20Chuke%20Sanam--hmp4.htm,https://fzmovies.net/imdb_images/Hum%20Dil%20De%20Chuke%20Sanam.jpg
Musical,Bollywood,Aashiqui,1990,BluRay,"Rahul and Anu Verghese meet on the same day, while both are held by the police on charges of creating a disturbance...",https://fzmovies.net/movie-Aashiqui--hmp4.htm,https://fzmovies.net/imdb_images/Aashiqui.jpg
Musical,Bollywood,Mere Yaar Ki Shaadi Hai,2002,BluRay,"Sanjay and Anjali are childhood chums . When Sanjay's roommate Ria questions him whether he has fallen for Anjali he vehemently denies . But the truth that he indeed loves her hits him like a ton of bricks when Sanjana calls him to tell that she is getting married to Rohit. Sanjay wants to win Anjali's heart at any cost and sets off on his ""noble"" cause of stopping the marriage . ...<more>",https://fzmovies.net/movie-Mere%20Yaar%20Ki%20Shaadi%20Hai--hmp4.htm,https://fzmovies.net/imdb_images/Mere%20Yaar%20Ki%20Shaadi%20Hai.jpg
Musical,Bollywood,Koyla,1997,DVDRip,"Mute Shankar slogs day and night to satisfy the lust of wealthy businessman Raja Saab who has underworld contact. Raja Saab would like to marry the young and street-wise, Gauri, however Gauri would like to see a picture of her would be husband but is instead shown Shankar's picture, she immediately falls in love with him and agrees to marry but at the wedding altar, Gauri gets a shock when she sees Raja Saab, refuses to continue with the rituals of the marriage and is locked forever in a room. Circumstances forced Shankar and Gauri to elope but both is caught by Raja and his men, who beats Shankar and throw him to his death and Gauri is taken back to Raja Saab mansion and must undergo preparations to get married to him. ...<more>",https://fzmovies.net/movie-Koyla--hmp4.htm,https://fzmovies.net/imdb_images/Koyla.jpg
Musical,Bollywood,Raja Hindustani,1996,BluRay,"Raja is a poor man who lives in India. He meets with a very rich girl, and both fall in love with each other...",https://fzmovies.net/movie-Raja%20Hindustani--hmp4.htm,https://fzmovies.net/imdb_images/Raja%20Hindustani.jpg
Musical,Bollywood,No Entry,2005,BluRay,"Kishen is a newspaper baron married to Kaajal, a housewife who suspects her husband of having numerous non-existent affairs. Pooja is the believing wife of ever-philandering globe-trotting businessman Prem. Kishen and Prem are thick pals. Sanjana falls in love with Prem's loyal photographer Sunny and they get engaged. Kishen gets tired of his jealous wife and tries to have an affair with Bobby, a call girl. Due to circumstances, Bobby is introduced as the wife of Kishen during Sanjana's wedding, and as Sunny's wife to Kaajal. It becomes a bundle of confusions when all three couples meet. ...<more>",https://fzmovies.net/movie-No%20Entry--hmp4.htm,https://fzmovies.net/imdb_images/No%20Entry.jpg
Musical,Bollywood,All The Best,2009,BluRay,The unexpected arrival of his elder NRI brother and assorted characters complicates the life of a Goan male.,https://fzmovies.net/movie-All%20The%20Best--hmp4.htm,https://fzmovies.net/imdb_images/All%20The%20Best.jpg
Musical,Bollywood,Chandni Chowk to China,2009,WEBRip,"Based in Delhi's Chandni Chowk, orphaned Sidhu is adopted by the owner of Bajrang Bali Parathas, known simply as Dada. Years later Sidhu has grown up and is an expert at slicing vegetables. When his Chinese friend and Philosopher, Chopstick, cons him into believing that he is the reincarnation of Liu Sheung, a slain Chinese revolutionary, Sidhu takes it upon himself to travel to the Zhange district where he will be forced to confront a deadly female assassin by the name of Suzy; be befriended by a semi-crazed beggar; and must face humiliation and possible death at the hands of the virtually indestructible Hojo. ...<more>",https://fzmovies.net/movie-Chandni%20Chowk%20to%20China--hmp4.htm,https://fzmovies.net/imdb_images/Chandni%20Chowk%20to%20China.jpg
Musical,Bollywood,Dil Se..,1998,WEBRip,"Amar Varma, a producer for Indian news radio, meets an enigmatic woman at a railroad station and then again at a hill station. He falls in love with her, but the woman, who calls herself Meghna, rejects and leaves him although she seems to be interested. Later, Varma agrees to marry his family's choice, Preeti. But suddenly Meghna is back, and what is the secret that she holds? ...<more>",https://fzmovies.net/movie-Dil%20Se..--hmp4.htm,https://fzmovies.net/imdb_images/Dil%20Se...jpg
Musical,Bollywood,Hum Tum,2004,BluRay,"Karan Kapoor and Rhea Prakash meet for the first time in a flight bound from Delhi to New York. They just cannot stand each other: Rhea is disgusted by Karan's flirtatious mannerisms and Karan is frustrated because of Rhea's overt seriousness. They have a massive fallout and part ways, vowing never to see each other's face again. Destiny brings them together again at Rhea's marriage ceremony three years later and the mars vs. venus war continues. Rhea gets married and leaves for USA. Four years later, Karan has become a successful cartoonist and travels to Paris to visit his father. Co-incidentally he meets Rhea again and learns that her husband is no more. Karan tries earnestly to bring happiness back in Rhea's life by promising her mother that he will find a suitable groom for Rhea but the duo never realizes that they are drawing closer to each other. Will love happen? And if it does, will the star-struck couple ever admit to it? Watch the breezy romantic musical comedy Hum Tum for the answers. ...<more>",https://fzmovies.net/movie-Hum%20Tum--hmp4.htm,https://fzmovies.net/imdb_images/Hum%20Tum.jpg
Musical,Bollywood,Main Prem Ki Diwani Hoon,2003,WEBRip,"The Kapoor family are very rich Indians who live in India and want their eldest daughter, a girl named Sanjana, to get married to an American-Indian businessman named Prem. Prem is welcomed, and after a few misunderstandings, both Sanjana and Prem fall in love with each other. Then chaos descends upon the Kapoor family when they find out that the boy named Prem is a fake, and that the real Prem was delayed and is now reaching India. How will this news affect Sanjana, who has given her heart to the fake Prem? ...<more>",https://fzmovies.net/movie-Main%20Prem%20Ki%20Diwani%20Hoon--hmp4.htm,https://fzmovies.net/imdb_images/Main%20Prem%20Ki%20Diwani%20Hoon.jpg
Musical,Bollywood,Tumko Na Bhool Paayenge,2002,WEBRip,"Vir, a young man from a rural village, learns on his wedding day that the people whom he thought were his parents arn't. After an attempt is made on his life by unknown gunmen, whom he kills them all using martal arts skills he didn't know he had, he learns that all of his dreams of a past life are real and that for the past three years he was raised by the couple after finding him in a river, half-dead with five bullet wounds in him. The search takes Vir to Bombay where he soon regains his memory and finds his real name to be a Muslim game marksman named Ali and is targed by criminal bigwigs and corrupt government officials whom he used to work for and betrayed him after hiring him to assasinate various underworld criminals and then framed him for the murder of an innocent chief minister. ...<more>",https://fzmovies.net/movie-Tumko%20Na%20Bhool%20Paayenge--hmp4.htm,https://fzmovies.net/imdb_images/Tumko%20Na%20Bhool%20Paayenge.jpg
Musical,Bollywood,Pardes,1997,WEBRip,"Pardes, is about Kishorilal who lives in America but has not forgotten his motherland India. His attachment with the country is deep and he hopes to find a daughter-in-law for his westernized, American son, Rajiv. He is especially taken by Ganga, the daughter of his friend Suraj Dev. He offers a marriage proposal between Ganga and Rajiv and they accept. He sends his foster son, Arjun to ensure Ganga approves of Rajiv. Soon Rajiv joins them and eventually both approve of each other. The engagement is set in India with the wedding in America. Ganga leaves for America with her new family and begins to adjust to her new surroundings. Her only friend is Arjun who she begins to form a special bond with. At first everything seems OK but as time goes on she realizes that Rajiv really isn't the person Arjun described to her while she was in India. She is right when she sees Rajiv smoking, drinking and to her shock finds out that he is still seeing his former girlfriend. She confronts Arjun and he realizes that he has fallen in love with her. Unfortunately her to be father-in-law sees this and he tells Arjun to leave the city. Ganga, now alone goes to Las Vegas with Rajiv. In a drunken state Rajiv tries to rape Ganga, she manages to knock him unconscious and runs away. Arjun, finds out Ganga is missing and looks for her. He finds her at a train station crying her eyes out and her clothes torn, she explains that Rajiv tried to rape her. He agrees to send her to India back to her family. Suraj Dev is misinformed with the circumstances in which Arjun brought Ganga to India. Believing Arjun ran away with Ganga, he tries to kill him. He fails and tells Arjun to leave the house. Suraj Dev does not listen to Ganga and she is locked up in a shed. She realizes that she is in love with Arjun. By this time Kishorilal has come to India. Rajiv comes as well and is ready to kill Arjun and take Ganga back to America. With the help of her brothers and sisters she manages to escape and stop Arjun from leaving. Rajiv and his friends finds them and beats Arjun up. He manages to break free and he beats Rajiv up, just when he is about to kill him, Kishorilal stops him. The truth comes out and he confesses in front of everyone is love for Ganga, yet he walks away and leaves her. Ganga tells everyone that Rajiv tried to rape her. Kishorilal realizes that his son is not good enough for Ganga and he breaks the engagement and tells Ganga to marry Arjun. Ganga and Arjun reunite and both get married. ...<more>",https://fzmovies.net/movie-Pardes--hmp4.htm,https://fzmovies.net/imdb_images/Pardes.jpg
Musical,Bollywood,Saajan,1991,WEB-DL,"Aman (Sanjay Dutt) is a poor, handicapped orphan who is befriended by wealthy Akash Verma (Salman Khan) during his childhood. Akash's parents adopt him and give him their family name, and Akash and Aman grow up as brothers. While Akash is a womanizer, Aman takes to writing poems under the pen name Sagar. The poems get published, and Aman becomes very popular. One of his fans is a young woman by the name of Pooja Saxena (Madhuri Dixit), who corresponds with Sagar. Akash meets Pooja and falls head over heels in love with her. When Aman comes to know this, he asks Akash to pose as Sagar, which he does, and Pooja and Akash fall in love with each other. A heartbroken Aman looks on, as he knows that although women may like his poetry, they will never come out openly and love him when they see his handicap. At the end, Akash discovers that Aman is actually Sagar and loves Pooja, so he decides to sacrifice his love for Aman. ...<more>",https://fzmovies.net/movie-Saajan--hmp4.htm,https://fzmovies.net/imdb_images/Saajan.jpg
Musical,Bollywood,Maine Pyar Kiya,1988,BluRay,"Kishen Kumar Chaudhary and Karan are family like friends, when Kishen's wife Mrs. Kaushalya gives birth to a baby boy Prem, Karan helps the couple bring up there child with out- most care. Years later the two friends have parted ways, Karan likes in a shanty house, works as a mechanic and is the father to a young girl Suman while Kishen is a wealthy industrialist and lives in a spacious bungalow. In order to accumulate huge sums of fund abroad for good living Karan decides to leave Suman in the care of the Chaudhary's family. All is well there for Suman as she is befriend by Prem which eventually blossom to love, Kaushalya finds out about Prem and Suman's relationship and approve of Suman as her daughter-in-law but Kishen is quite unhappy with the relationship as he have plans to get Prem marry to his business partner's daughter Seema thus he insults Suman and throw her out of his house. Karan returns and is enraged at the treatment his daughter receive and leaves the house immediately with his daughter. Prem too is unhappy with his dad's decision and he also leaves the house opting to marry Suman with the blessings of Karan. But Karan refuses to accept Prem and the only way Prem can win Karan's approval is if he prove that he can earn money by his own sweat. ...<more>",https://fzmovies.net/movie-Maine%20Pyar%20Kiya--hmp4.htm,https://fzmovies.net/imdb_images/Maine%20Pyar%20Kiya.jpg
Musical,Bollywood,Salaam-E-Ishq,2007,DVDRip,"Born in Dehra Dun, temperamental and ambitious Kamna changes her name to Kamini, hires Babu as her Manager and becomes one of the most sought-after heroines in Bollywood. As a publicity stunt and to get the attention of film-maker Karan Johar, she recruits Rahul to pose as her childhood sweetheart and future husband - which result in nothing but insecurities for both - as Rahul reveals his true character and starts to blackmail her; Gia Bakshi lives with her dad, Col. Bakshi and is in love with Shiven Dungarpur, both are to get married shortly, but Shiven starts to get cold feet and decides to disappear from her life, leaving Col. Bakshi no alternative but to arrange Gia's marriage with Rohit Chhada; Gia's sister, Seema, lives in Britain, has been married to Vinay Malhotra for 15 years, & they have two children. While preparing to travel to India for Gia's marriage, Seema finds out that Vinay is having an affair with a gorgeous woman named Anjali - leaving her with nothing but heartbreak; Ashutosh Raina is a Hindu, but falls in love and gets married to Tehzeeb Hussain, who is Muslim, much to the chagrin of his dad who will not have anything to do with him. Tehzeeb is a TV news-reporter, and while traveling on an inaugural train route, the train derails, Tehzeeb survives but loses her memory, and is unable to recall who Ashutosh is - and may end up leaving him and returning to her parents' home; Raju is a taxi-driver, who comes to the assistance of a Caucasian female, Stefanie, who is frantically trying to hunt down her lover, Rohit Chhada. Raju drives her around Northern India and finally to the venue where Rohit is getting ready to get married to Gia - Stefanie will get her true love back?; Ramdayal weds attractive Phoolwati and would like to spend some intimate moments with her but comical circumstances prevent him from doing so. Watch what happens as fate takes these couples to their varying destinations. ...<more>",https://fzmovies.net/movie-Salaam-E-Ishq--hmp4.htm,https://fzmovies.net/imdb_images/Salaam-E-Ishq.jpg
Musical,Bollywood,Sooryavansham,1999,WEBRip,"A zamindar and his family called ""The Sooryavansh family"" of Bharathpur village has a God like image among the villagers. This generation is headed by Thakur Bhanupratap Singh. He has 3 sons, the youngest, Heera he considers to be the black sheep, and most illiterate of the family, and he will not have anything to do with him. Deshraj Thakur, a village badman goes to jail as a result of the judgement given by the Panchayat headed by Bhanu Pratap and ignoring his own misdeeds develops vengeance against Bhanu Pratap. Bhanupratap is enraged when Heera proposes to marry his ward, Gauri; and even more angered when Heera flip-flops, albeit at the request of Gauri, and refuses to marry her. Heera is shunned by one and all in the family, including Gauri. And then Radha enters his life; she marries him; encourages him to live independently; and helps his business flourish. Soon they are blessed with birth of a son. In a strange situation Bhanu Pratap meets his grandson and friendship blossoms then. Heera fulfills his father's dream of a charitable hospital for the poor and named it after his father. This makes Bhanu Pratap feel proud of his son. Gradually, love takes place in the mind of Bhanu Pratap substituting hatred for Heera and his family. Deshraj plans to kill Bhanu Pratap through his innocent grandson by mixing poison in the 'kheer' the boy is carrying for his grandfather, and wants to put the blame on Heera. The poisoned Bhanu Pratap is hospitalized. Cunning Deshraj succeeds in convincing the people that Heera has planned to kill his father and thereby wants to eliminate Bhanu Pratap and provokes people against Heera. Suddenly Bhanu Pratap enters the scene and unfolds the evil designs of Deshraj Thakur to the villagers. Both the father and son are united once again. ...<more>",https://fzmovies.net/movie-Sooryavansham--hmp4.htm,https://fzmovies.net/imdb_images/Sooryavansham.jpg
Musical,Bollywood,Mujhse Dosti Karoge,2002,DVDRip,A young man in England regularly mails his childhood sweetheart in India is unaware that the replies he receives are written by another girl.,https://fzmovies.net/movie-Mujhse%20Dosti%20Karoge--hmp4.htm,https://fzmovies.net/imdb_images/Mujhse.Dosti.Karoge.2002.jpg
Musical,Bollywood,Saawariya,2007,BluRay,"Two souls arrive in a small town, one on vacation, the other to meet a lover. They spend the most magical dream-like days of their lives in that town... with each other....<more>",https://fzmovies.net/movie-Saawariya--hmp4.htm,https://fzmovies.net/imdb_images/Saawariya.jpg
Musical,Bollywood,Qayamat Se Qayamat Tak,1998,BluRay,A young man and young woman fall in love against their feuding fathers' wishes; Romeo and Juliet set in contemporary India.,https://fzmovies.net/movie-Qayamat%20Se%20Qayamat%20Tak--hmp4.htm,https://fzmovies.net/imdb_images/Qayamat%20Se%20Qayamat%20Tak.jpg
Musical,Bollywood,Baadshah,1998,DVDRip,"K. Jhunjhunwala would like to locate his missing/runaway daughter, Seema Malhotra, so that he can get her married to Nitin Dharampal; Prominent businessman, Mahindra, would like to negotiate with his daughter, Sonu's kidnappers, and secure her release. And the Central Bureau of Investigation would like to protect the life of Chief Minister Gayetri Bachchan under the mission code-named ""Maa"", and the CBI Officer in Charge to be code-named ""Baadshah"". Now Baadshah happens to be a bumbling and out of work Private Investigator, who has agreed to assist Jhunjhunwala and Mahindra, and while doing so is mistaken for the CBI Agent, ends up working for the assassins, and must assassinate Gayetri or end up losing his team of four fellow-bumblers, and Mahindra's daughter. What results is hilarious chaos, with no one knowing what the other is doing, and each one being each other's suspect(s). To make matters worse Jhunjhunwala is not really Seema's dad, but someone else with an ulterior motive. ...<more>",https://fzmovies.net/movie-Baadshah--hmp4.htm,https://fzmovies.net/imdb_images/Baadshah.jpg
Musical,Bollywood,Ishq,1997,BluRay,Harbans Rai and Ranjit Rai are two wealthy businessmen who absolutely *loathe* poverty and poor people ...,https://fzmovies.net/movie-Ishq--hmp4.htm,https://fzmovies.net/imdb_images/Ishq.jpg
Musical,Bollywood,Mirzya,2016,BluRay,"A horse groom reconnects with his childhood love, but she is engaged to marry the local prince.",https://fzmovies.net/movie-Mirzya--hmp4.htm,https://fzmovies.net/imdb_images/Mirzya.2016.jpg
