genre,category,title,year,distribution,description,url,cover_photo
Musical,Hollywood,K 12,2019,WEB-DL,"In this eerily enchanting musical film by Melanie Martinez, Cry Baby, a strong and sensitive girl, is sent off to a disturbing sleepaway school that's hidden underneath a grandiose façade. Luckily, she has a sweet and unapologetic best friend who sticks up for her when she gets bullied by the…...<more>",https://fzmovies.net/movie-K%2012--hmp4.htm,https://fzmovies.net/imdb_images/K.12.2019.jpg
Musical,Hollywood,All That Jazz,1979,BluRay,"Joe Gideon is a Broadway director, choreographer and filmmaker, he in the process of casting the chorus and staging the dance numbers for his latest Broadway show, starring his ex-wife Audrey Paris in what is largely a vanity project for her in playing a role several years younger than her real…Tags : dancer...<more>",https://fzmovies.net/movie-All%20That%20Jazz--hmp4.htm,https://fzmovies.net/imdb_images/All.That.Jazz.1979.jpg
Musical,Hollywood,Bugsy Malone,1976,BluRay,"A gangster movie where all the gangsters are played by children. Instead of real bullets they use ""splurge guns"" that cover the victim in cream. The story tells of the rise of ""Bugsy Malone"" and the battle for power between ""Fat Sam"" and ""Dandy Dan"". Written by Steve CrookTags : singing | gangster...<more>",https://fzmovies.net/movie-Bugsy%20Malone--hmp4.htm,https://fzmovies.net/imdb_images/Bugsy.Malone.1976.jpg
Musical,Hollywood,Dream Moms,2023,WEBRip,"Two moms whose Broadway dreams got deferred, enter a TV talent show competition together and learn that it's never too late to become what or who you want to be....<more>",https://fzmovies.net/movie-Dream%20Moms--hmp4.htm,https://fzmovies.net/imdb_images/Dream.Moms.2023.jpg
Musical,Hollywood,Daffodils,2019,WEB-DL,A bittersweet love story told with beautiful re-imaginings of iconic New Zealand songs.,https://fzmovies.net/movie-Daffodils--hmp4.htm,https://fzmovies.net/imdb_images/Daffodils.2019.jpg
Musical,Hollywood,Fishermans Friends,2019,BluRay,Ten fisherman from Cornwall are signed by Universal Records and achieve a top ten hit with their debut album of Sea Shanties. Tags : singer | artist...<more>,https://fzmovies.net/movie-Fishermans%20Friends--hmp4.htm,https://fzmovies.net/imdb_images/Fishermans.Friends.2019.jpg
Musical,Hollywood,Mariah Carey Merry Christmas to All,2022,WEBRip,"The singer-songwriter performs a repertoire of her festive holiday hits, including the chart-topping perennial favorite ""All I Want for Christmas Is You.""Tags : tv special...<more>",https://fzmovies.net/movie-Mariah%20Carey%20Merry%20Christmas%20to%20All--hmp4.htm,https://fzmovies.net/imdb_images/Mariah.Carey.Merry.Christmas.to.All.2022.jpg
Musical,Hollywood,Follow That Dream 1962,1962,BluRay,"When the Kwimper family car runs out of gas on a new Florida highway and an officous state supervisor tries to run them off, Pop Kwimper digs in his heels and decides to do a little ......<more>",https://fzmovies.net/movie-Follow%20That%20Dream%201962--hmp4.htm,https://fzmovies.net/imdb_images/Follow.That.Dream.1962.jpg
Musical,Hollywood,The Pied Piper 1972,1972,BluRay,"Greed, corruption, ignorance, and disease. Midsummer, 1349: the Black Death reaches northern Germany. Minstrels go to Hamelin for the Mayor's daughter's wedding to the Baron's son. He wants......<more>",https://fzmovies.net/movie-The%20Pied%20Piper%201972--hmp4.htm,https://fzmovies.net/imdb_images/The.Pied.Piper.1972.jpg
Musical,Hollywood,Dreaming of a Jewish Christmas,2018,WEB-DL,"""White Christmas,"" ""Rudolph the Red-Nose Reindeer,"" and ""Do you Hear What I Hear,"" these popular holiday songs and many others have created the essential music to modern Christmas. Many of them were also created by predominately Jewish composers like Irving Berlin, cultural outsiders in a Western…Tags : christmas | musician | jew...<more>",https://fzmovies.net/movie-Dreaming%20of%20a%20Jewish%20Christmas--hmp4.htm,https://fzmovies.net/imdb_images/Dreaming.of.a.Jewish.Christmas.2017.jpg
Musical,Hollywood,How to Succeed in Business Without Really Trying 1967,1967,BluRay,"Armed with the titular manual, an ambitious window washer seeks to climb the corporate ladder.",https://fzmovies.net/movie-How%20to%20Succeed%20in%20Business%20Without%20Really%20Trying%201967--hmp4.htm,https://fzmovies.net/imdb_images/How.to.Succeed.in.Business.Without.Really.Trying.1967.jpg
Musical,Hollywood,The Three Caballeros,1945,BluRay,"A large box arrives for Donald on his birthday, three gifts inside. He unwraps one at a time, and each takes him on an adventure. The first is a movie projector with a film about the birds of South America; Donald watches two cartoons, one tells of a penguin who longs to live on a tropical isle and…Tags : mexico | birthday...<more>",https://fzmovies.net/movie-The%20Three%20Caballeros--hmp4.htm,https://fzmovies.net/imdb_images/The.Three.Caballeros.1944.jpg
Musical,Hollywood,Yankee Doodle Dandy,1942,BluRay,"A film of the life of the renowned musical composer, playwright, actor, dancer and singer George M. Cohan.",https://fzmovies.net/movie-Yankee%20Doodle%20Dandy--hmp4.htm,https://fzmovies.net/imdb_images/Yankee.Doodle.Dandy.1942.jpg
Musical,Hollywood,Spring Awakening Those Youve Known,2022,WEBRip,"Fifteen years after the Tony-winning Broadway run of Spring Awakening, the original cast and creative team reunite for a spectacular, one night only concert....<more>",https://fzmovies.net/movie-Spring%20Awakening%20Those%20Youve%20Known--hmp4.htm,https://fzmovies.net/imdb_images/Spring.Awakening.Those.Youve.Known.2022.jpg
Musical,Hollywood,The Sound of Christmas,2022,WEBRip,A woman facing eviction just before Christmas who must navigate budding romantic feelings for a handsome billionaire when she takes a job nannying for his two children right before Christmas.Tags : christmas...<more>,https://fzmovies.net/movie-The%20Sound%20of%20Christmas--hmp4.htm,https://fzmovies.net/imdb_images/The.Sound.of.Christmas.2022.jpg
Musical,Hollywood,Hair 1979,1979,BluRay,"Claude Bukowski leaves the family ranch in Oklahoma for New York where he is rapidly embraced into the hippie group of youngsters led by Berger, yet he's already been drafted. He soon falls in love with Sheila Franklin, a rich girl but still a rebel inside....<more>",https://fzmovies.net/movie-Hair%201979--hmp4.htm,https://fzmovies.net/imdb_images/Hair.1979.jpg
Musical,Hollywood,Hairspray,1988,BluRay,A 'pleasantly plump' teenager teaches 1962 Baltimore a thing or two about integration after landing a spot on a local TV dance show.,https://fzmovies.net/movie-Hairspray--hmp4.htm,https://fzmovies.net/imdb_images/Hairspray.1988.jpg
Musical,Hollywood,The Unsinkable Molly Brown 1964,1964,BluRay,"A poor, uneducated mountain girl leaves her cabin in search of respect, a wealthy husband, and a better life.",https://fzmovies.net/movie-The%20Unsinkable%20Molly%20Brown%201964--hmp4.htm,https://fzmovies.net/imdb_images/The.Unsinkable.Molly.Brown.1964.jpg
Musical,Hollywood,Meet Me in St Louis,1944,BluRay,"St. Louis 1903. The well-off Smith family has four beautiful daughters, including Esther and little Tootie. 17-year old Esther has fallen in love with the boy next door who has just moved in, John. He however barely notices her at first. The family is shocked when Mr. Smith reveals that he has been…...<more>",https://fzmovies.net/movie-Meet%20Me%20in%20St%20Louis--hmp4.htm,https://fzmovies.net/imdb_images/Meet.Me.In.St.Louis.1944.jpg
Musical,Hollywood,Yentl,1983,BluRay,"Eastern Europe, 1904. A Jewish woman, Yentl, has a thirst for knowledge but is prohibited from learning due to the restrictions of her religion. When her father dies, she sets off to increase her knowledge, posing as a man in order to gain admission to a Jewish religious school. Written by grantssTags : book...<more>",https://fzmovies.net/movie-Yentl--hmp4.htm,https://fzmovies.net/imdb_images/Yentl.1983.jpg
Musical,Hollywood,Sextette,1978,DVDRip,"Marlo Manners is enjoying her honeymoon with Sir Michael Barrington, husband number 6. As luck would have it, an international conference is taking place in the same hotel and the Russian delegate (one of Marlo's former husbands) is threatening to derail the negotiations unless he can have one more…Tags : hotel | honeymoon...<more>",https://fzmovies.net/movie-Sextette--hmp4.htm,https://fzmovies.net/imdb_images/Sextette.1978.jpg
Musical,Hollywood,The Music Man 1962,1962,BluRay,Harold Hill poses as a boys' band leader to con naive Iowa townsfolk.,https://fzmovies.net/movie-The%20Music%20Man%201962--hmp4.htm,https://fzmovies.net/imdb_images/The.Music.Man.1962.jpg
Musical,Hollywood,Baby Sharks Big Movie,2023,WEB-DL,Plot Unknowm.Tags : animal in title...<more>,https://fzmovies.net/movie-Baby%20Sharks%20Big%20Movie--hmp4.htm,https://fzmovies.net/imdb_images/Baby.Sharks.Big.Movie.2023.jpg
Musical,Hollywood,Viva Las Vegas,1964,BluRay,"Lucky Jackson arrives in town with his car literally in tow ready for the first Las Vegas Grand Prix - once he has the money to buy an engine. He gets the cash easily enough but mislays it when the pretty swimming pool manageress takes his mind off things. It seems he will lose both race and girl,…Tags : rivalry...<more>",https://fzmovies.net/movie-Viva%20Las%20Vegas--hmp4.htm,https://fzmovies.net/imdb_images/viva.las.vegas.1964.jpg
Musical,Hollywood,Love Gets a Room,2021,WEB-DL,"A group of actors perform in the heart of the Warsaw Ghetto, in a life or death context on a run-down stage.",https://fzmovies.net/movie-Love%20Gets%20a%20Room--hmp4.htm,https://fzmovies.net/imdb_images/Love.Gets.a.Room.2021.jpg
Musical,Hollywood,A Chorus Line 1985,1985,BluRay,Hopefuls try out before a demanding director for a part in a new musical.,https://fzmovies.net/movie-A%20Chorus%20Line%201985--hmp4.htm,https://fzmovies.net/imdb_images/A.Chorus.Line.1985.jpg
Musical,Hollywood,The Muppet Movie,1979,BluRay,"While living the quiet life in a swamp, Kermit the Frog is approached by a Hollywood agent to audition for the chance of a lifetime. So Kermit takes this chance for his big break as he makes the journey to Hollywood. Along the way, Kermit comes across several quirky new friends including comedic…...<more>",https://fzmovies.net/movie-The%20Muppet%20Movie--hmp4.htm,https://fzmovies.net/imdb_images/The.Muppet.Movie.1979.jpg
Musical,Hollywood,One Hour with You,1932,BluRay,"Andre and Colette Bertier are happily married. When Colette introduces her husband to her flirtatious best friend, Mitzi, he does his best to resist her advances. But she is persistent, and very cute, and he succumbs. Mitzi's husband wants to divorce her, and has been having her tailed. Andre gets…Tags : divorce | adultery | unfaithfulness...<more>",https://fzmovies.net/movie-One%20Hour%20with%20You--hmp4.htm,https://fzmovies.net/imdb_images/One.Hour.with.You.1932.jpg
Musical,Hollywood,Its a Very Merry Muppet Christmas Movie,2002,BluRay,"The owner of a bank (Miss Bitterman) wants to own the Muppet Theatre so she can build a nightclub over it. After she tricks Pepe into giving her the only copy of the contract between her father and the Muppets, she changes it so the Muppets have very little time to pay a debt they owe. Meanwhile,…Tags : christmas | angel...<more>",https://fzmovies.net/movie-Its%20a%20Very%20Merry%20Muppet%20Christmas%20Movie--hmp4.htm,https://fzmovies.net/imdb_images/Its.a.Very.Merry.Muppet.Christmas.Movie.2002.jpg
Musical,Hollywood,Graffiti Bridge 1990,1990,BluRay,The unofficial sequel to 'Purple Rain' (1984). The Kid is now club owner and rival to Morris (Morris Day) who get into a fight for the Glam Slam Nightclub. ...<more>,https://fzmovies.net/movie-Graffiti%20Bridge%201990--hmp4.htm,https://fzmovies.net/imdb_images/Graffiti.Bridge.1990.jpg
Musical,Hollywood,Journey to Bethlehem,2023,BluRay,"This live-action Christmas musical adventure for the entire family weaves classic Christmas melodies with humor, faith, and new pop songs in a retelling of the greatest story ever told: the story of Mary and Joseph and the birth o......<more>",https://fzmovies.net/movie-Journey%20to%20Bethlehem--hmp4.htm,https://fzmovies.net/imdb_images/Journey.to.Bethlehem.2023.jpg
Musical,Hollywood,The Return of Captain Invincible,1984,BluRay,"In WWII, Captain Invincible used his superpowers against the Nazis, and he was a hero. But when they accused him of supporting the communists, he retired to Australia. Now, after a US super secret super weapon is stolen, he's asked to come back, to help. Unfortunately, he's an alcoholic now... --…Tags : alcoholic | nazi | superhero...<more>",https://fzmovies.net/movie-The%20Return%20of%20Captain%20Invincible--hmp4.htm,https://fzmovies.net/imdb_images/The.Return.of.Captain.Invincible.1983.jpg
Musical,Hollywood,Help 1965,1965,BluRay,"An Eastern cult discovers that the sacrificial ring is missing. Ringo, drummer of The Beatles band has it; sent by the girl (who's to be sacrificed) as a gift. Clang, Ahme, Bhuta and several cult members leave for London to retrieve the ring. After several failed attempts to steal the ring, they…Tags : restaurant...<more>",https://fzmovies.net/movie-Help%201965--hmp4.htm,https://fzmovies.net/imdb_images/Help.1965.jpg
Musical,Hollywood,Camelot,1967,BluRay,"The story of the marriage of England's King Arthur to Guinevere is played out amid the pagentry of Camelot. The plot of illegitimate Modred to gain the throne and Guinevere's growing attachment to Sir Lancelot, whom she at first abhors, threaten to topple Arthur and destroy his ""round table"" of…...<more>",https://fzmovies.net/movie-Camelot--hmp4.htm,https://fzmovies.net/imdb_images/Camelot.1967.jpg
Musical,Hollywood,Two Buddies and a Badger The Great Big Beast,2020,WEBRip,"Life in the tunnel is going well for Tootson, Ludiwood and Badger-oh! A life of singing, eating jam and friendly teasing. But one day they are visited by a Train Conductor. She is very stern and she has an eviction letter! Tunnels ar...<more>",https://fzmovies.net/movie-Two%20Buddies%20and%20a%20Badger%20The%20Great%20Big%20Beast--hmp4.htm,https://fzmovies.net/imdb_images/Two.Buddies.and.a.Badger.The.Great.Big.Beast.2020.jpg
Musical,Hollywood,Frankie and Johnny,1966,BluRay,"A riverboat singer with a weakness for gambling wants to find his lucky red head, but his girlfriend Frankie is not amused.Tags : death...<more>",https://fzmovies.net/movie-Frankie%20and%20Johnny--hmp4.htm,https://fzmovies.net/imdb_images/Frankie.and.Johnny.1966.jpg
Musical,Hollywood,A Day at the Races 1937,1937,DVDRip,"A veterinarian posing as a doctor, a race-horse owner and his friends struggle to help keep a sanitarium open with the help of a misfit race-horse.",https://fzmovies.net/movie-A%20Day%20at%20the%20Races%201937--hmp4.htm,https://fzmovies.net/imdb_images/A.Day.At.The.Races.1937.jpg
Musical,Hollywood,Be Happy [the musical],2019,WEB-DL,"The MGMC presents a great show in London. Between the audience: Peter, a freudian psychiatrist married to a Finnish actor, Mika, David, a young British gay living in Banyoles, addicted to Grinder, and Coco Lamour, a Parisian French actress. Peter is a friend of Maria, also a Freudian psychiatrist,…...<more>",https://fzmovies.net/movie-Be%20Happy%20[the%20musical]--hmp4.htm,https://fzmovies.net/imdb_images/Be.Happy.2019.jpg
Musical,Hollywood,The Care Bears Movie,1985,BluRay,"The Care Bears team up with a troubled brother and sister who just moved to a new town, to help a neglected young sorcerer's apprentice whose evil magic book causes sinister things to happen.Tags : magician | good versus evil...<more>",https://fzmovies.net/movie-The%20Care%20Bears%20Movie--hmp4.htm,https://fzmovies.net/imdb_images/The.Care.Bears.Movie.1985.jpg
Musical,Hollywood,Kiss Me Kate 1953,1953,BluRay,"An ex-husband and wife team star in a musical version of 'The Taming of the Shrew'; off-stage, the production is troublesome with ex-lovers' quarrels and a gangster looking for some money owed to them....<more>",https://fzmovies.net/movie-Kiss%20Me%20Kate%201953--hmp4.htm,https://fzmovies.net/imdb_images/Kiss.Me.Kate.1953.jpg
Musical,Hollywood,Sgt Peppers Lonely Hearts Club Band,1978,BluRay,"Ever since they were sent into World War I battle in 1918, Sergeant Pepper and his Lonely Hearts Club Band of Heartland, USA have been spreading the message of joy and love to the world, which has made them and Heartland famous. Upon Sergeant Pepper's death in 1958, the band's instruments have been…...<more>",https://fzmovies.net/movie-Sgt%20Peppers%20Lonely%20Hearts%20Club%20Band--hmp4.htm,https://fzmovies.net/imdb_images/Sgt.Peppers.Lonely.Hearts.Club.Band.1978.jpg
Musical,Hollywood,At War with the Army 1951,1951,BluRay,"Alvin Corwin is low man on the totem pole, and goes from one mishap to another at an army training camp in World War II.",https://fzmovies.net/movie-At%20War%20with%20the%20Army%201951--hmp4.htm,https://fzmovies.net/imdb_images/At.War.with.the.Army.1950.jpg
Musical,Hollywood,The Harry Hill Movie 2013,2013,BluRay,"When he thinks his hamster Abu has just a week to live, Harry Hill and his gran take the hamster to Blackpool. However, Harry's twin Otto wants to kidnap Abu and sends Ed and Kisko to pursue them. ...<more>",https://fzmovies.net/movie-The%20Harry%20Hill%20Movie%202013--hmp4.htm,https://fzmovies.net/imdb_images/Harry.Hill.Movie.2013.jpg
Musical,Hollywood,High Society,1956,WEBRip,"C.K. Dexter-Haven, a successful popular jazz musician, lives in a mansion near his ex-wife's Tracy Lord's family estate. She is on the verge of marrying a man blander and safer than Dex, who tries to win Tracy's heart again. Mike Connor, an undercover tabloid reporter, also falls for Tracy while…Tags : reporter | musician | wedding...<more>",https://fzmovies.net/movie-High%20Society--hmp4.htm,https://fzmovies.net/imdb_images/High_Society_1956.jpg
Musical,Hollywood,The Brave Little Toaster,1987,DVDRip,"A group of dated appliances that find themselves stranded in a summer home that their family had just sold, decide to, á la ""The Incredible Journey"", seek their young 8 year old ""master"". Children's film which on the surface is a frivolous fantasy, but with a dark subtext of abandonment,…...<more>",https://fzmovies.net/movie-The%20Brave%20Little%20Toaster--hmp4.htm,https://fzmovies.net/imdb_images/The.Brave.Little.Toaster.1987.jpg
Musical,Hollywood,You ll Never Get Rich 1941,1941,BluRay,"After his wife discovers a telltale diamond bracelet, impresario Martin Cortland tries to show he's not chasing after showgirl Sheila Winthrop. Choreographer Robert Curtis gets caught in ... ...<more>",https://fzmovies.net/movie-You%20ll%20Never%20Get%20Rich%201941--hmp4.htm,https://fzmovies.net/imdb_images/You.ll.Never.Get.Rich.1941.jpg
Musical,Hollywood,Romance on the High Seas,1948,BluRay,"Socialite Elvira Kent suspects her husband of fooling around with other women. When he announces he can't join her on their scheduled ocean voyage, she hires a nightclub singer, Georgia Garrett, to pose as her on the cruise. Elvira stays at a hotel near home so she can spy on her husband. She's…Tags : singer | nightclub | wedding...<more>",https://fzmovies.net/movie-Romance%20on%20the%20High%20Seas--hmp4.htm,https://fzmovies.net/imdb_images/Romance.on.the.High.Seas.1948.jpg
Musical,Hollywood,The Garbage Pail Kids Movie 1987,1987,BluRay,Dodger must confront the struggles of life as he is visited by the Garbage Pail Kids and intimidated by some older bullies.Tags : bully | vomiting...<more>,https://fzmovies.net/movie-The%20Garbage%20Pail%20Kids%20Movie%201987--hmp4.htm,https://fzmovies.net/imdb_images/The.Garbage.Pail.Kids.Movie.1987.jpg
Musical,Hollywood,Jumbo 1962,1962,DVDRip,A debt-ridden circus is saved by a well-meaning but inept publicity man.,https://fzmovies.net/movie-Jumbo%201962--hmp4.htm,https://fzmovies.net/imdb_images/Jumbo.1962.jpg
Musical,Hollywood,Bye Bye Birdie 1963,1963,BluRay,"A rock singer travels to a small Ohio town to make his ""farewell"" television performance and kiss his biggest fan before he is drafted.",https://fzmovies.net/movie-Bye%20Bye%20Birdie%201963--hmp4.htm,https://fzmovies.net/imdb_images/Bye.Bye.Birdie.1963.jpg
Musical,Hollywood,The Cheetah Girls,2003,BluRay,Four teens aim to take the world by storm with their music.Tags : female protagonist | friendship...<more>,https://fzmovies.net/movie-The%20Cheetah%20Girls--hmp4.htm,https://fzmovies.net/imdb_images/The.Cheetah.Girls.2003.jpg
Musical,Hollywood,The Black Pack Excellence,2022,WEBRip,Features special guests to commemorate Juneteenth and celebrate Black excellence and culture with musical and dance performances.Tags : tv special...<more>,https://fzmovies.net/movie-The%20Black%20Pack%20Excellence--hmp4.htm,https://fzmovies.net/imdb_images/The.Black.Pack.Excellence.2022.jpg
Musical,Hollywood,Bells Are Ringing 1960,1960,BluRay,Ella Peterson is a Brooklyn telephone answering service operator who tries to improve the lives of her clients by passing along bits of information she hears from other clients. She falls ... ...<more>,https://fzmovies.net/movie-Bells%20Are%20Ringing%201960--hmp4.htm,https://fzmovies.net/imdb_images/Bells.Are.Ringing.1960.jpg
Musical,Hollywood,Xanadu 1980,1980,BluRay,The story of a girl who makes dreams come true,https://fzmovies.net/movie-Xanadu%201980--hmp4.htm,https://fzmovies.net/imdb_images/Xanadu.1980.jpg
Musical,Hollywood,Manifest Destiny Down Spacetime,2019,WEB-DL,"In this absurdist satire, an awkward OCD physics genius and a hot ex-Catholic sorority girl wake up after blacking out Halloween night to discover they missed the evacuation of Earth. A mysterious agent pursues the feuding couple as they figure out how to work together to solve the recently…Tags : halloween...<more>",https://fzmovies.net/movie-Manifest%20Destiny%20Down%20Spacetime--hmp4.htm,https://fzmovies.net/imdb_images/Manifest.Destiny.Down.Spacetime.2019.jpg
Musical,Hollywood,Halloween Is Grinch Night,1977,BluRay,"A strange wind blows into Whoville, making all the inhabitants stay indoors. They know the wind means the Grinch will be in a foul mood and out to do harm. However, young Eukariah decides to confront the Grinch.Tags : boy | child | rabbit...<more>",https://fzmovies.net/movie-Halloween%20Is%20Grinch%20Night--hmp4.htm,https://fzmovies.net/imdb_images/Halloween.Is.Grinch.Night.1977.jpg
Musical,Hollywood,King Creole,1958,BluRay,"Having flunked graduation for a second time and needing cash to support his crabby (and thus unemployed) father, Danny Fisher takes a job as a singer in the King Creole nightclub - about the only joint around not run by smarmy crook Maxie Fields who wants him for his own place. He gets on pretty…Tags : singer | nightclub...<more>",https://fzmovies.net/movie-King%20Creole--hmp4.htm,https://fzmovies.net/imdb_images/King.Creole.1958.jpg
Musical,Hollywood,Absolute Beginners 1986,1986,BluRay,"In 1958 London a young photographer seeks media stardom to keep the love of a beautiful, aspiring fashion designer.",https://fzmovies.net/movie-Absolute%20Beginners%201986--hmp4.htm,https://fzmovies.net/imdb_images/Absolute.Beginners.(1986).jpg
Musical,Hollywood,The Glass Slipper,1955,DVDRip,"In a small pleasant European village, there is one unhappy person: Ella. She is despised by everyone, and mistreated by her stepmother and stepsisters. Out feeling miserable one day, Ella meets a handsome young man, who falls for her. He is really Prince Charles, the son of the Duke, but he tells…Tags : prince...<more>",https://fzmovies.net/movie-The%20Glass%20Slipper--hmp4.htm,https://fzmovies.net/imdb_images/The.Glass.Slipper.1955.jpg
Musical,Hollywood,Easter Parade,1948,BluRay,"Don Hewes and Nadine Hale are a dancing team, but she decides to start a career on her own. So he takes the next dancer he meets, Hannah Brown, as a new partner. After a while this new team is so successful, that Florenz Ziegfeld is interested in them, but due to the fact that Nadine Hale dances…Tags : dance | dancing | dancer...<more>",https://fzmovies.net/movie-Easter%20Parade--hmp4.htm,https://fzmovies.net/imdb_images/Easter.Parade.1948.jpg
Musical,Hollywood,Pajama Party,1964,WEBRip,"Gogo, a Martian teenager, is sent to Earth to prepare the way for an invasion. The first Earthling he meets, one Aunt Wendy, is a rich widow who runs a dress shop catering to teenagers. Her nephew, Big Lunk, is a volleyball-loving guy with little interest in romance, which causes frustration for…Tags : teenager | motorcycle...<more>",https://fzmovies.net/movie-Pajama%20Party--hmp4.htm,https://fzmovies.net/imdb_images/Pajama.Party.1964.jpg
Musical,Hollywood,Horse Feathers 1932,1932,BluRay,"Quincy Adams Wagstaff, the new president of Huxley University, hires bumblers Baravelli and Pinky to help his school win the big football game against rival Darwin University. ...<more>",https://fzmovies.net/movie-Horse%20Feathers%201932--hmp4.htm,https://fzmovies.net/imdb_images/Horse.Feathers.1932.jpg
Musical,Hollywood,Scrooge 1970,1970,BluRay,"In 1860, cranky old miser Ebenezer Scrooge hates Christmas; loathes people and defends the decrease of the surplus of poor population; runs his bank exploiting his employee Bob Cratchit and clients, giving a bitter treatment to his own nephew and acquaintances. However, on Christmas Eve, he is…Tags : remake | christmas | spirit...<more>",https://fzmovies.net/movie-Scrooge%201970--hmp4.htm,https://fzmovies.net/imdb_images/Scrooge.1970.jpg
Musical,Hollywood,The Boy Friend 1971,1971,BluRay,"When the leading lady of a low-budget musical revue sprains her ankle, the assistant stage manager is forced to understudy and perform in her place, becoming a star and finding love in the process. ...<more>",https://fzmovies.net/movie-The%20Boy%20Friend%201971--hmp4.htm,https://fzmovies.net/imdb_images/The.Boy.Friend.1971.jpg
