genre,category,title,year,distribution,description,url,cover_photo
Music,Hollywood,His Fathers Voice,2019,WEB-DL,"A gifted male dancer separated from his musician father in childhood, must return to him, to be able to dance again.",https://fzmovies.net/movie-His%20Fathers%20Voice%20--hmp4.htm,https://fzmovies.net/imdb_images/His.Fathers.Voice.2019.jpg
Music,Hollywood,Echo in the Canyon,2018,BluRay,"A look at the roots of the historic music scene in L.A.'s Laurel Canyon featuring the music of iconic groups such as The Byrds, The Beach Boys, Buffalo Springfield, and The Mamas and the Papas.
Tags : california...<more>",https://fzmovies.net/movie-Echo%20in%20the%20Canyon--hmp4.htm,https://fzmovies.net/imdb_images/Echo.in.the.Canyon.2018.jpg
Music,Hollywood,A Little Night Music,1978,DVDRip,"Fredrik Egerman is very happy in his marriage to a seventeen-year-old virgin, Anne. Only she's been a virgin for the whole eleven months of the marriage, and being a bit restless, Fredrik goes to see an old flame, the famous actress Desiree Armfeldt. Desiree is getting tired of her life, and is…...<more>",https://fzmovies.net/movie-A%20Little%20Night%20Music--hmp4.htm,https://fzmovies.net/imdb_images/A.Little.Night.Music.1977.jpg
Music,Hollywood,Fancy Pants,1950,BluRay,"An American actor (Arthur Tyler) impersonating an English butler is hired by a nouveau riche woman (Effie Floud) from New Mexico to refine her husband and headstrong daughter (Aggie). The complications increase when the town believes Arthur to be an Earl, and President Roosevelt decides to pay a…...<more>",https://fzmovies.net/movie-Fancy%20Pants--hmp4.htm,https://fzmovies.net/imdb_images/Fancy.Pants.(1950).jpg
Music,Hollywood,Road to Singapore,1940,BluRay,Two playboys try to forget previous romances in Singapore - until they meet a beautiful dancer.,https://fzmovies.net/movie-Road%20to%20Singapore--hmp4.htm,https://fzmovies.net/imdb_images/Road.to.Singapore.1940.jpg
Music,Hollywood,Girl Crazy,1943,BluRay,"A young philandering playboy is sent to a College, somewhere in the American West, and organizes a show, together with his sweetheart, to save the college from closure due to falling enrollments.Tags : college...<more>",https://fzmovies.net/movie-Girl%20Crazy--hmp4.htm,https://fzmovies.net/imdb_images/Girl.Crazy.1943.jpg
Music,Hollywood,Ski Party,1965,WEBRip,"On a college ski weekend, Todd and Craig pretend to be Jane and Nora, a pair of English girls. Their reasons? To meet girls, and to learn to ski. Along the way, Lesley Gore shows up on the bus to sing ""Sunshine, Lollipops, and Rainbows"", and James Brown and the Famous Flames appear at the lodge to…...<more>",https://fzmovies.net/movie-Ski%20Party--hmp4.htm,https://fzmovies.net/imdb_images/Ski.Party.1965.jpg
Music,Hollywood,Ali Baba Goes to Town,1937,DVDRip,"A movie company is doing the Arabian Nights when a hobo enters their camp, falls asleep and dreams he's back in Baghdad as advisor to the Sultan. In a spoof of Rosevelt's New Deal, he organizes work programs, taxes the rich and abolishes the army. Written by Ed StephanTags : remake...<more>",https://fzmovies.net/movie-Ali%20Baba%20Goes%20to%20Town--hmp4.htm,https://fzmovies.net/imdb_images/Ali.Baba.Goes.To.Town.1937.jpg
Music,Hollywood,Damn Yankees [What Lola Wants],1958,BluRay,Film adaptation of the George Abbott Broadway musical about a Washington Senators fan who makes a pact with the Devil to help his baseball team win the league pennant. Written by Stewart M. ClamenTags : profanity...<more>,https://fzmovies.net/movie-Damn%20Yankees%20[What%20Lola%20Wants]--hmp4.htm,https://fzmovies.net/imdb_images/Damn_Yankees_1958.jpg
Music,Hollywood,Awaken 2018,2018,BluRay,"Executive produced by cinema pioneers Terrence Malick and Godfrey Reggio, AWAKEN is a celebration of the spirit of life, an exploration of the Earth, and an ode to the Cosmos.

...<more>",https://fzmovies.net/movie-Awaken%202018--hmp4.htm,https://fzmovies.net/imdb_images/Awaken.2018.jpg
Music,Hollywood,The Strings,2020,WEB-DL,"In the dead of winter, a musician travels to a remote cottage to work on new material, but soon finds herself under attack from a mysterious dark presence.Tags : musician...<more>",https://fzmovies.net/movie-The%20Strings--hmp4.htm,https://fzmovies.net/imdb_images/The.Strings.2020.jpg
Music,Hollywood,Bride of the Wind,2001,DVDRip,"Vienna, 1902: Alma Schindler meets Gustav Mahler. She beautiful, young, plays, and composes: music is her life. She becomes Mahler's lover, then he marries her, asking that she give up composing. She has two children, works as his assistant, does his books, saves him from debt, and feels stifled.Tags : death...<more>",https://fzmovies.net/movie-Bride%20of%20the%20Wind--hmp4.htm,https://fzmovies.net/imdb_images/Bride_of_the_Wind_2001.jpg
Music,Hollywood,Gold Diggers of 1933,1933,BluRay,"Chorus girls Polly, Carol and Trixie are ecstatic when they learn that Broadway producer Barney Hopkins is putting on a new show. He promises all of the girls parts in the new show and even hires their neighbor Brad Roberts, an unknown composer, to write some of the music. There's only one problem:…Tags : remake...<more>",https://fzmovies.net/movie-Gold%20Diggers%20of%201933--hmp4.htm,https://fzmovies.net/imdb_images/Gold.Diggers.of.1933.1933.jpg
Music,Hollywood,SoulBoy,2010,BluRay,A coming-of-age drama set in the 1970s Northern Soul underground music scene.,https://fzmovies.net/movie-SoulBoy--hmp4.htm,https://fzmovies.net/imdb_images/Soulboy.2010.jpg
Music,Hollywood,Anchors Aweigh,1945,WEB-DL,A pair of sailors on leave try to help a movie extra become a singing star.Tags : buddy movie...<more>,https://fzmovies.net/movie-Anchors%20Aweigh--hmp4.htm,https://fzmovies.net/imdb_images/Anchors.Aweigh.1945.jpg
Music,Hollywood,Counterpoint,1968,BluRay,"During a December 1944 German offensive in Belgium, a USO symphonic orchestra entertaining the front-line American troops is captured by the Germans. Initially, the Germans want to execute them, in accordance with orders received from Berlin. However, the orchestra leader, world-famous conductor…Tags : winter | nazi...<more>",https://fzmovies.net/movie-Counterpoint--hmp4.htm,https://fzmovies.net/imdb_images/Counterpoint.1968.jpg
Music,Hollywood,Round Midnight,1986,BluRay,"In 'Round Midnight, real-life jazz legend Dexter Gordon brilliantly portrays the fictional tenor sax player Dale Turner, a musician slowly losing the battle with alcoholism, estranged from his family, and hanging on by a thread in the 1950's New York jazz world. Dale gets an offer to play in Paris,…Tags : musician | alcoholism...<more>",https://fzmovies.net/movie-Round%20Midnight--hmp4.htm,https://fzmovies.net/imdb_images/Round_Midnight_1986.jpg
Music,Hollywood,Take Me Out to the Ball Game,1949,BluRay,"The Wolves baseball team gets steamed when they find they've been inherited by one K.C. Higgins, a suspected ""fathead"" who intends to take an active interest in running the team. But K.C. turns outs to be a beautiful woman who really knows her baseball. Second baseman Dennis Ryan promptly falls in…Tags : baseball...<more>",https://fzmovies.net/movie-Take%20Me%20Out%20to%20the%20Ball%20Game--hmp4.htm,https://fzmovies.net/imdb_images/Take_Me_Out_to_the_Ball_Game_1949.jpg
Music,Hollywood,Turn It Around The Story of East Bay Punk,2017,BluRay,"A documentary spanning over 30 years of the California Bay Area's punk music history with a central focus on the emergence of Berkeley's inspiring 924 Gilman Street music collective. Narrated by Iggy Pop and executive produced by Green Day, Turn It Around: The Story of East Bay Punk is the…...<more>",https://fzmovies.net/movie-Turn%20It%20Around%20The%20Story%20of%20East%20Bay%20Punk--hmp4.htm,https://fzmovies.net/imdb_images/Turn.It.Around.The.Story.of.East.Bay.Punk.2017%20.jpg
Music,Hollywood,Never Steal Anything Small,1959,BluRay,"Jake MacIllaney will do just about anything to win the presidential election of longshoreman union Local 26. When he encounters young upright attorney Dan Cabot and Cabot's attractive wife, Linda, MacIllaney breaks up their marriage, pursues Linda, and pins a grand larceny rap on Dan. And all set…Tags : gangster...<more>",https://fzmovies.net/movie-Never%20Steal%20Anything%20Small--hmp4.htm,https://fzmovies.net/imdb_images/Never_Steal_Anything_Small_1959.jpg
Music,Hollywood,Babes in Arms,1939,DVDRip,"Mickey Moran, a talented singer and musician, is son of a veteran from show business. Mickey has a partner, Patsy Barton, a pretty girl and also a very talented singer. One day, a big opportunity arrives for Mickey, a big contract to set up his own show. However, things don't go well, and in order…...<more>",https://fzmovies.net/movie-Babes%20in%20Arms--hmp4.htm,https://fzmovies.net/imdb_images/Babes.in.Arms.1939.jpg
Music,Hollywood,Thank Your Lucky Stars,1943,BluRay,Two producers are putting together a Calvacade of Stars for a wartime charity show. Along with a list of well-knowns they promote the work of an unknown singer and songwriter. Written by Ed Stephan...<more>,https://fzmovies.net/movie-Thank%20Your%20Lucky%20Stars--hmp4.htm,https://fzmovies.net/imdb_images/Thank.Your.Lucky.Stars.1943.jpg
Music,Hollywood,Young Man with a Horn [Young Man of Music],1950,BluRay,"Aimless youth Rick Martin learns he has a gift for music and falls in love with the trumpet. Legendary trumpeter Art Hazzard takes Rick under his wing and teaches him all he knows about playing. To the exclusion of anything else in life, Rick becomes a star trumpeter, but his volatile personality…Tags : crying...<more>",https://fzmovies.net/movie-Young%20Man%20with%20a%20Horn%20[Young%20Man%20of%20Music]--hmp4.htm,https://fzmovies.net/imdb_images/Young_Man_with_a_Horn_1950.jpg
Music,Hollywood,Ladies in Lavender,2005,WEBRip,Two sisters befriend a mysterious foreigner who washes up on the beach of their 1930s Cornish seaside village.Tags : russian...<more>,https://fzmovies.net/movie-Ladies%20in%20Lavender--hmp4.htm,https://fzmovies.net/imdb_images/Ladies.in.Lavender.2004.jpg
Music,Hollywood,The Tune,1992,DVDRip,"Del is a song writer for the obnoxious Mr. Mega, and in love with Didi, Mega's secretary. His quest to write a hit tune brings him to the wacky world of Flooby Nooby, where he just might learn to write songs from the heart. Written by Thomas PluckTags : waitress | musician...<more>",https://fzmovies.net/movie-The%20Tune--hmp4.htm,https://fzmovies.net/imdb_images/The.Tune.1992.jpg
Music,Hollywood,Chuck Berry Hail Hail Rock,1987,BluRay,"This documentary movie covers two concerts at the Fox Theatre in St. Louis, Missouri, to celebrate Chuck Berry's 60th birthday, and also discusses his life and career.Tags : character name in title...<more>",https://fzmovies.net/movie-Chuck%20Berry%20Hail%20Hail%20Rock%20--hmp4.htm,https://fzmovies.net/imdb_images/Chuck.Berry.Hail.Hail.Rock.n.Roll.1987.jpg
Music,Hollywood,Stowaway,1936,DVDRip,"Ching-Ching gets lost in Shanghai and is befriended by American playboy Tommy Randall. She falls asleep in his car which winds up on a ship headed for America. Susan Parker, also on the ship, marries Randall to give Chin-Ching a family. Written by Ed StephanTags : girl...<more>",https://fzmovies.net/movie-Stowaway--hmp4.htm,https://fzmovies.net/imdb_images/Stowaway.1936.jpg
Music,Hollywood,March of the Wooden Soldiers,1934,BluRay,"Ollie Dee and Stanley Dum try to borrow money from their employer, the toymaker, to pay off the mortgage on Mother Peep's shoe and keep it and Little Bo Peep from the clutches of the evil Barnaby. When that fails, they trick Barnaby into marrying Stanley Dum instead of Bo Peep. Enraged, Barnaby…Tags : holiday...<more>",https://fzmovies.net/movie-March%20of%20the%20Wooden%20Soldiers--hmp4.htm,https://fzmovies.net/imdb_images/March.of.the.Wooden.Soldiers.1934.jpg
Music,Hollywood,Neptunes Daughter,1949,BluRay,"Scatterbrained Betty Barrett mistakes masseur Jack Spratt for Jose O'Rourke, the captain of the South American polo team. Spratt goes along with the charade, but the situation becomes more complicated when they fall in love. Meanwhile, Betty's sensible older sister Eve fears Betty's heart will be…...<more>",https://fzmovies.net/movie-Neptunes%20Daughter--hmp4.htm,https://fzmovies.net/imdb_images/Neptunes_Daughter_1949.jpg
Music,Hollywood,Jupiters Darling,1955,DVDRip,"Fabius loves his beautiful but vulnerable city, Rome, and he also loves his beautiful but invulnerable fiancée, Amytis. Fascinated by the tales she has heard about Hannibal, who is about to attack Rome, Amytis is driven by curiosity to the edge of his camp. Captured, she makes a last request of…Tags : camp...<more>",https://fzmovies.net/movie-Jupiters%20Darling--hmp4.htm,https://fzmovies.net/imdb_images/Jupiters_Darling_1955.jpg
Music,Hollywood,The Country Girl,1955,BluRay,"A director hires an alcoholic has-been and strikes up a stormy relationship with the actor's wife, who he believes is the cause of all the man's problems.Tags : alcoholic | actor...<more>",https://fzmovies.net/movie-The%20Country%20Girl--hmp4.htm,https://fzmovies.net/imdb_images/The.Country.Girl.1954.jpg
Music,Hollywood,The Beatles and India,2021,WEB-DL,"A unique historical chronicle of the enduring love affair between The Beatles and India that started more than half a century ago. Rare archival footage, photographs and eye-witness accounts, along with location shoots across India, ...<more>",https://fzmovies.net/movie-The%20Beatles%20and%20India--hmp4.htm,https://fzmovies.net/imdb_images/The.Beatles.and.India.2021.jpg
Music,Hollywood,The Source Family,2012,DVDRip,"A feature documentary film set in Hollywood, examining a radical experiment in '70s utopian living. The Source Family were the darlings of the Sunset Strip until their communal living, outsider ideals and spiritual leader Father Yod's 13 wives became an issue with local authorities. They fled to…Tags : cult...<more>",https://fzmovies.net/movie-The%20Source%20Family--hmp4.htm,https://fzmovies.net/imdb_images/the.source.family.2012.jpg
Music,Hollywood,Athena,1954,BluRay,"The story about two sisters in love. Everything should be wonderful, but father doesn't approve of his daughters' physically underdeveloped fianc&eacute;s.Tags : muscleman | character name as title...<more>",https://fzmovies.net/movie-Athena--hmp4.htm,https://fzmovies.net/imdb_images/Athena.1954.jpg
Music,Hollywood,The Chronicle of Anna Magdalena Bach,1968,BluRay,"A chronicle of Johann Sebastian Bach's life, eschewing drama to focus almost entirely on his music. Narrated by his wife Anna in voiceover, it consists largely of static scenes of Bach conducting and/or playing his brilliant compositions. Written by Mike D'AngeloTags : woman...<more>",https://fzmovies.net/movie-The%20Chronicle%20of%20Anna%20Magdalena%20Bach--hmp4.htm,https://fzmovies.net/imdb_images/The.Chronicle.of.Anna.Magdalena.Bach.1968.jpg
Music,Hollywood,The Rise of the Synths,2019,BluRay,The Rise of the Synths is a documentary and a time travel about the universe of creating sounds and the Synthwave Music.Tags : interview...<more>,https://fzmovies.net/movie-The%20Rise%20of%20the%20Synths--hmp4.htm,https://fzmovies.net/imdb_images/The.Rise.of.the.Synths.2019.jpg
Music,Hollywood,JKs House,2013,WEBRip,"Blending family values and life lessons with music and dance, JK's House entertains while teaching kids important life lessons about such topics as being thankful, patience, manners, caring, sharing, family focused and much more.Tags : dance...<more>",https://fzmovies.net/movie-JKs%20House--hmp4.htm,https://fzmovies.net/imdb_images/JKs.House.2013.jpg
Music,Hollywood,Shout,1991,WEBRip,A new music teacher in a 1955 West Texas home for wayward boys brings new vision and hope for many of the interned boys.Tags : teacher | texas...<more>,https://fzmovies.net/movie-Shout--hmp4.htm,https://fzmovies.net/imdb_images/Shout.1991.jpg
Music,Hollywood,Heartbreak Hotel,1988,BluRay,"When a teen tries to set up a band at his school, his mother who was a big fan of Elvis Presley gets in a wreck he and his band members decides to kidnap Elvis and have him hooked up with his mother.Tags : musician...<more>",https://fzmovies.net/movie-Heartbreak%20Hotel--hmp4.htm,https://fzmovies.net/imdb_images/Heartbreak.Hotel.1988.jpg
Music,Hollywood,The Competition 1980,1980,DVDRip,"The movie centers on a piano competition whose winner is assured of success. It is Paul's last chance to compete, but newcomer Heidi may be a better pianist. Can romance be far away? Will she take a dive despite the pressure to win from her teacher, Greta, or will she condemn Paul to obscurity?…Tags : piano | kiss...<more>",https://fzmovies.net/movie-The%20Competition%201980--hmp4.htm,https://fzmovies.net/imdb_images/The_Competition_1980.jpg
Music,Hollywood,The Sparks Brothers,2021,BluRay,A musical odyssey through five weird and wonderful decades with Ron and Russell Mael celebrating the inspiring legacy of Sparks.Tags : american abroad...<more>,https://fzmovies.net/movie-The%20Sparks%20Brothers--hmp4.htm,https://fzmovies.net/imdb_images/The.Sparks.Brothers.2021.jpg
Music,Hollywood,Song of the Thin Man,1947,BluRay,Nick and Nora Charles are on a gambling boat when someone is murdered. The two main suspects are at large and come to Nick for help. Nick turns them into the police but then sets out to figure out the mystery.Tags : private detective | marriage...<more>,https://fzmovies.net/movie-Song%20of%20the%20Thin%20Man--hmp4.htm,https://fzmovies.net/imdb_images/Song.of.the.Thin.Man.1947.jpg
Music,Hollywood,Cabin in the Sky,1943,DVDRip,"Chronic gambler and carouser ""Little"" Joe Jackson is shot by Domino Johnson at Jim Henry's gambling club over an outstanding gambling debt. Little Joe's wife, the God-fearing Petunia Jackson, prays not only for her husband's mortal life, but also his eternal soul as she's afraid that if he dies…Tags : hell | shooting | church | singer...<more>",https://fzmovies.net/movie-Cabin%20in%20the%20Sky--hmp4.htm,https://fzmovies.net/imdb_images/Cabin.in.the.Sky.1943.jpg
Music,Hollywood,Moon Over Miami,1941,DVDRip,"Kay, Barbara and Susan Latimer come into a small legacy when they expected a large one, then abandon the Texas greasy-spoon where they work to hunt in Miami for rich husbands, said to be plentiful there. Barbara and Susan posing as the secretary and maid of ""wealthy"" Kay, they check into a posh…Tags : remake | texas | sister...<more>",https://fzmovies.net/movie-Moon%20Over%20Miami--hmp4.htm,https://fzmovies.net/imdb_images/Moon.Over.Miami.1941.jpg
Music,Hollywood,Moonlight on the Prairie,1935,DVDRip,Ace returns to the town where he is suspected of murder. He quickly become involved in the scheme to keep Barbara Roberts from reaching her ranch. To inherit the ranch she must reach it by midnight. Ace agrees to get her there knowing she is the widow of the man he supposedly killed. Written by…Tags : song | singer...<more>,https://fzmovies.net/movie-Moonlight%20on%20the%20Prairie--hmp4.htm,https://fzmovies.net/imdb_images/Moonlight.on.the.Prairie.1935.jpg
Music,Hollywood,Road to Utopia,1946,BluRay,Two vaudeville flops pose as bad guys and join the Klondike gold rush with a saloon singer.Tags : road movie | alaska...<more>,https://fzmovies.net/movie-Road%20to%20Utopia--hmp4.htm,https://fzmovies.net/imdb_images/Road.to.Utopia.1945.jpg
Music,Hollywood,At Long Last Love,1975,BluRay,"Four socialite old friends unexpectedly clash, and switch partners during a party and attempt to make each other jealous.Tags : neo screwball comedy | love | friend | singer...<more>",https://fzmovies.net/movie-At%20Long%20Last%20Love--hmp4.htm,https://fzmovies.net/imdb_images/At.Long.Last.Love.1975.jpg
Music,Hollywood,Passing Strange,2009,WEBRip,"Director Spike Lee's passionate adaptation of the thrilling Broadway musical about a young bohemian who experiences sex, drugs and rock and roll on his journey to selfhood.Tags : african american | coming of age | drugs...<more>",https://fzmovies.net/movie-Passing%20Strange--hmp4.htm,https://fzmovies.net/imdb_images/Passing.Strange.2009.jpg
Music,Hollywood,Thats Entertainment Part II,1976,DVDRip,"The second installment in the ""That's Entertainment"" trilogy features more classic scenes from MGM's vast musical library with the addition of comedy and drama films.Tags : paris france...<more>",https://fzmovies.net/movie-Thats%20Entertainment%20Part%20II--hmp4.htm,https://fzmovies.net/imdb_images/Thats.Entertainment.Part.II.1976.jpg
Music,Hollywood,My Gal Sal,1942,BluRay,"Chronicles the early life of gay nineties-era songwriter Paul Dresser as he outgrows his job as carnival entertainer and moves up into New York society, writing one hit song after another. Despite his egotistical behavior, he manages to woo and win Sally Elliott, one of the more popular…...<more>",https://fzmovies.net/movie-My%20Gal%20Sal--hmp4.htm,https://fzmovies.net/imdb_images/My.Gal.Sal.1942.jpg
Music,Hollywood,A Chorus of Disapproval,1989,WEBRip,"A man new to a smallish British town joins an amateur theatre company. Once there, he discovers that the drama on stage is quite often nothing compared to what's happening behind the scenes: seduction, romance, faction fighting, and the inevitable jealosy. Written by Murray Chapman...<more>",https://fzmovies.net/movie-A%20Chorus%20of%20Disapproval--hmp4.htm,https://fzmovies.net/imdb_images/A_Chorus_of_Disapproval_1989.jpg
Music,Hollywood,Privilege,1967,BluRay,Steven Shorter is the ultimate British music star. His music is listened to by everyone from pre-teens to grandparents. He has no trace of public bad habits or drug involvement. Everyone in Britain loves him. His handlers begin to use his popularity for projects like increasing the consumption of…Tags : british | christian...<more>,https://fzmovies.net/movie-Privilege--hmp4.htm,https://fzmovies.net/imdb_images/Privilege.1967.jpg
Music,Hollywood,Jerry Springer The Opera,2005,WEBRip,"'Jerry Springer-The Opera' tells the story of a day in the job of world famous talk-show host, Jerry Springer. Jerry has to sort out a number of guests problems; including a man who wants to dress up as a baby, a man with 3 lovers (one of them a transexual) and a fat woman who wants to be a pole…Tags : devil...<more>",https://fzmovies.net/movie-Jerry%20Springer%20The%20Opera--hmp4.htm,https://fzmovies.net/imdb_images/Jerry_Springer_The_Opera_2005.jpg
Music,Hollywood,Idiots Delight,1939,DVDRip,"When song-and-dance man Harry Van returns from World War I, he finds work hard to come by. His greatest success comes as straight man in a phony vaudeville mind-reading act with the tipsy Madame Zulieka. While on tour in Omaha he meets acrobat Irene Fellara, and they have a brief romance. Twenty…Tags : champagne...<more>",https://fzmovies.net/movie-Idiots%20Delight%20--hmp4.htm,https://fzmovies.net/imdb_images/Idiots_Delight_1939.jpg
Music,Hollywood,Festival,1967,DVDRip,"Black and white footage of performances, interviews, and conversations at the Newport Folk Festival, from 1963 to 1966. The headliners are Peter, Paul and Mary, Joan Baez, Pete Seeger, and Bob Dylan, who's acoustic and electric. Son House and Mike Bloomfield talk about the blues; John Hurt, Howlin'…Tags : interview...<more>",https://fzmovies.net/movie-Festival--hmp4.htm,https://fzmovies.net/imdb_images/Festival.1967.jpg
Music,Hollywood,Spidarlings,2016,BluRay,"Poverty stricken lovers Eden and Matilda have enough trouble just getting through the days, but when Eden buys a pet spider the real troubles start.Tags : spider...<more>",https://fzmovies.net/movie-Spidarlings--hmp4.htm,https://fzmovies.net/imdb_images/Spidarlings.2016.jpg
Music,Hollywood,The Belle of New York,1952,DVDRip,"In squeaky-clean New York at the turn of the century, playboy Charlie Hill falls so much in love that he can walk on air. The object of his affections is beautiful Angela Bonfils, a mission house worker in the Bowery. He promises to reform his dissolute life, even trying to do an honest day's work.Tags : dance | remake...<more>",https://fzmovies.net/movie-The%20Belle%20of%20New%20York--hmp4.htm,https://fzmovies.net/imdb_images/The.Belle.of.New.York.1952.jpg
Music,Hollywood,Dawn at Socorro,1954,DVDRip,"Brett Wade, gambler, gunslinger, and classical pianist, is wounded in a gunfight with the Ferris clan; the doctor finds signs of tuberculosis. En route to Colorado for his health, Brett stops in Socorro, New Mexico along with Ferris gunfighter Jimmy Rapp. Sheriff Couthen fears another shootout, but…...<more>",https://fzmovies.net/movie-Dawn%20at%20Socorro%20--hmp4.htm,https://fzmovies.net/imdb_images/Dawn.at.Socorro.1954.jpg
Music,Hollywood,The One and Only Genuine Original Family Band,1968,DVDRip,"The Bower Family Band petitions the Democratic National Committee to sing a Grover Cleveland rally song at the 1888 convention, but decide instead to move to the Dakota territory on the urging of a suitor to their eldest daughter. There, Grampa Bower causes trouble with his pro-Cleveland ideas, as…Tags : band...<more>",https://fzmovies.net/movie-The%20One%20and%20Only%20Genuine%20Original%20Family%20Band--hmp4.htm,https://fzmovies.net/imdb_images/The.One.and.Only.Genuine.Original.Family.Band.1968.jpg
Music,Hollywood,The Smiling Lieutenant,1931,DVDRip,"Lieutenant Niki of the Austrian royal guard has a new girlfriend, Franzi. He's crazy about her and is smiling at her while on duty in the street. King Adolf and his daughter Princess Anna from the neighboring kingdom of Flausenthurm drive by, and Anna intercepts a wink meant for Franzi. She falls…Tags : remake...<more>",https://fzmovies.net/movie-The%20Smiling%20Lieutenant--hmp4.htm,https://fzmovies.net/imdb_images/The.Smiling.Lieutenant.1931.jpg
